title,company,location,salary_min,salary_max,description,created,search_title,skills_found,salary_range,skill_count,has_salary
Data Scientist,Systechcorp Inc,"Hyderabad, Telangana",,,"We are inviting applications for the role of Lead Consultant – Data Scientist with experience in Artificial Intelligence and Generative Models . We're seeking a talented and experienced professional to join our team and play a key role in developing cutting-edge, AI-powered solutions using large language models. Key Responsibilities Collaborate with cross-functional teams to identify, analyze, and interpret complex datasets to generate actionable insights. Design, develop, and implement: Advanc…",2026-04-11T07:09:57Z,Data Scientist,,Not disclosed,0,False
Data Scientist,ECS | Enterprise Change Specialists,"Hyderabad, Telangana",,,"Job Summary We are seeking a Senior Data Scientist to drive AI, Machine Learning, and Advanced Analytics initiatives, generating actionable business insights. The ideal candidate will lead data science projects, optimize real-time data pipelines, and collaborate with cross-functional stakeholders. Expertise in Elastic, Tableau, Power BI, OpenAI, and Big Data frameworks (Hadoop, Kafka) is essential. Must-Have Skills (Mandatory) - AI/ML model development for solving complex business challenges - …",2025-03-20T17:42:53Z,Data Scientist,"tableau, power bi, machine learning",Not disclosed,3,False
Data Scientist,Hashone careers,"Bangalore, Karnataka",600000,2400000,"Job Title: Data Scientist Location: Bangalore (Hybrid/On-site depending on project needs) About the Role We are seeking a highly skilled Data Scientist to join our team in Bangalore. In this role, you will take ownership of data science components across client projects, build production-ready ML and GenAI-powered applications, and mentor junior team members. You will collaborate with engineering teams to design and deploy impactful solutions that leverage cutting-edge machine learning and larg…",2025-09-18T06:56:06Z,Data Scientist,machine learning,"600,000 - 2,400,000",1,True
Bi Analyst,BETSOL,"Bangalore, Karnataka",,,"Job Description About the Role The Business Intelligence (BI) Analyst will help turn data into actionable insights that drive better decisions across the organization. In this role, you'll partner with stakeholders to answer key business questions, build scalable reporting solutions, and ensure the quality, consistency, and trustworthiness of our data. You'll play a critical role in shaping how data is used — moving beyond static reporting to delivering insights that influence outcomes. This is…",2026-05-28T09:51:53Z,BI Analyst,,Not disclosed,0,False
Bi Analyst,Gunnebo Entrance Control,India,,,"Do you want to be part of creating a safer world? Without thinking about it, you meet us in your everyday life – at home, in transit, and at work. We are at the airport, where you commute, where you work, play and shop. Diverse in our offering, our customer outreach and in our mindset, Gunnebo Entrance Control is leading the transformation of the security business through digitalisation and connectivity for the continuous developments of smart entrance control. If you are passionate about being…",2026-02-26T20:38:54Z,BI Analyst,,Not disclosed,0,False
Bi Analyst,Eurofins GSC IT DC,"Bangalore, Karnataka",,,"Job Description Support Specialist Analyses approved requirements from stakeholders (across IT and business functions) Liaises with stakeholders and product owners in clarifying and detailing out requirements Works with the data engineers and the domain experts to extract and transform the data Designs, creates, and maintains the dashboards in the BI platform (Power BI Cloud) Demonstrates the accuracy of figures Deploys the dashboards to production Documents reporting user guides and data dicti…",2026-05-13T09:20:14Z,BI Analyst,power bi,Not disclosed,1,False
Bi Analyst,People First Consultants,"Vadodara, Gujarat",,,"The BI Analyst is responsible for the technical implementation of BI solutions by leveraging knowledge of data warehouse models, data visualization, data analysis, and software development methodologies. Additionally, this position will work with the Manager of Business Intelligence and Analytics, Archer Senior Leadership, Business Operations, and other pertinent parties to define, prioritize and develop business intelligence and analytics solutions. • Design and development of reporting soluti…",2025-12-31T06:32:50Z,BI Analyst,data visualization,Not disclosed,1,False
Bi Analyst,Amgen,"Hyderabad, Telangana",,,"ABOUT AMGEN Amgen harnesses the best of biology and technology to fight the world's toughest diseases, and make people's lives easier, fuller and longer. We discover, develop, manufacture and deliver innovative medicines to help millions of patients. Amgen helped establish the biotechnology industry more than 40 years ago and remains on the cutting-edge of innovation, using technology and human genetic data to push beyond what's known today. ABOUT THE ROLE Role Description: As a BI Analyst in t…",2026-03-24T09:32:36Z,BI Analyst,,Not disclosed,0,False
Bi Analyst,Convoso,"Vadodara, Gujarat",,,"Convoso is a leading AI-powered contact center platform purpose-built for revenue teams. Since 2006, Convoso has remained at the forefront of innovation, consistently developing solutions to drive customer growth while supporting adherence to regulatory standards. Who We Are: While headquartered in Los Angeles, the Convoso team can be found around the globe working in either a hybrid or remote capacity. Awarded as a ""best place to work"" company, our culture fosters team integrity, positive pers…",2026-05-28T02:21:19Z,BI Analyst,,Not disclosed,0,False
Bi Analyst,Kalypso A Rockwell Automation Business,"Delhi, India",,,"• BI Solution Development: Design and implement Power BI dashboards and analytics solutions • Data Integration: Work with SQL Server, SharePoint, and Azure SQL databases • Power Platform Development: Build solutions using Power Apps, Power Automate, and Dataverse • Requirement Gathering: Translate business needs into BI and analytics solutions • SQL Development: Write and optimize SQL queries for data processing and reporting • System Design: Understand and maintain BI architecture and source s…",2026-04-29T07:53:43Z,BI Analyst,"sql, power bi, azure",Not disclosed,3,False
Sr Bi Analyst / Lead Bi Analyst,USEReady,"Bangalore, Karnataka",800000,1200000,"Sr BI Analyst / Lead BI Analyst Must Have: At least 3 to 6 years of techno functional / technical experience in delivering projects for Large Enterprises Strong background in data analysis, data sources, data warehouse and business intelligence Progressive experience in areas of ETL, Data Modelling, Data Visualization, Reporting and Analytics Familiarity with database concepts, SQL queries, joins and programming Experience in system administration, problem debugging, and solution design Formal …",2019-06-05T21:12:24Z,BI Analyst,"sql, data visualization","800,000 - 1,200,000",2,True
Data/Bi Analyst,Topcoder,"Noida, Ghaziabad",,,"The Data/BI Analyst will be responsible for exploring and understanding complex data models, maintaining existing data marts (DDPs), and creating new ones to support the marketing department’s analytical needs. This role requires a strong technical foundation in data warehousing and transformation, as well as a keen business sense to translate data into strategic recommendations. The ideal candidate will be a proactive problem solver with a passion for data quality and efficiency. Key Responsib…",2025-10-02T14:59:22Z,BI Analyst,,Not disclosed,0,False
Bi Analyst / Lead,Tech Tammina,India,,,"This role will help Open Blue teams and leaders with critical reports and metrics needed to run our business. This person is a strong communicator, who can guide a requirements giver to describing what they want and need in a metric and dashboard. They can also ask thoughtful questions of the datasets, investigate their fit for purpose and use good judgement. Lastly, they are able to use a variety of technologies from simple to complex, to create and iterate on the reports and visuals via user …",2026-04-18T07:36:42Z,BI Analyst,,Not disclosed,0,False
Sr. Bi Analyst,Amherst College,India,,,"The Amherst Group's companies are comprised of leading real estate investment and advisory firms with a mission to transform the way real estate is owned, financed and managed. Amherst leverages its proprietary data, analytics, technology, and decades of experience to seek solutions for a fragmented, slow-to-evolve real estate ecosystem and to materially improve the experience for residents, buyers, sellers, communities, and investors. Today Amherst has over 1000 employees and $14.1 billion in …",2026-05-08T02:08:10Z,BI Analyst,,Not disclosed,0,False
Senior Bi Analyst,Visy India,"Hyderabad, Telangana",,,"About Visy: Visy is a family-owned Australian business and a global pioneer in sustainable packaging, recycling and logistics. They operate across 150 sites globally, including operations in Asia, Europe, and the USA, supported by a dedicated workforce of over 7,000 employees. It is Australia and New Zealands largest manufacturer of food and beverage packaging, made from household recycling. As Australias largest recycler, it processes 40% of Australian households recycling. Visy also supports …",2026-04-28T09:45:15Z,BI Analyst,,Not disclosed,0,False
Senior Bi Analyst,Cushman & Wakefield,India,,,"Job Title Senior BI Analyst Job Description Summary Job Description About The Role: BI Solution Development: a. Design, develop, and maintain reports and dashboards using PowerBI b. Collaborate with the Transformation and Broker Market Support Shared Services Team to ensure data accuracy, consistency, and timeliness. c. Stay up to date with the latest PowerBI features, best practices, and industry trends and incorporate them into the development and maintenance process. BI Development Efforts: …",2026-03-16T01:55:20Z,BI Analyst,,Not disclosed,0,False
Senior Bi Analyst,Skillz,"Bangalore, Karnataka",,,"Join Skillz and Level Up Your Career! Are you ready to take your career to the next level? Join Skillz, the first publicly-traded mobile esports platform that hosts billions of casual mobile gaming tournaments for millions of players worldwide. Skillz is revolutionizing the gaming industry, providing the ultimate platform for competitive mobile games. By fostering social competition within games, Skillz empowers developers to create multi-million dollar franchises while connecting players throu…",2026-05-29T02:28:30Z,BI Analyst,,Not disclosed,0,False
Senior Bi Analyst,PhonePe,"Bangalore, Karnataka",,,Key deliverables: Analyze CX data to identify performance trends and root causes. Translate business issues into analytical problem statements. Deliver insight-driven narratives to inform CX strategy decisions. Collaborate with teams to design dashboards and streamline data consumption. Role responsibilities: Monitor CX metrics and evaluate the impact of interventions. Work with cross-functional teams to solve inefficiencies. Present analytical insights to stakeholders with data-backed stories.…,2026-04-18T07:36:42Z,BI Analyst,,Not disclosed,0,False
Zonal Bi Analyst,JSFB,India,,,"Job Description Development & maintenance of business MIS & provide actionable insights Key Responsibilities: • Should work well in a team environment and able to meet TAT • Sharp eye towards identifying anomalies in data. • Familiarity with any one of BI tools like Power BI, Tableau, COGNOS, Business Objects, Micro Strategy, Click Sense, and Click View would be an added advantage.",2026-05-13T02:12:22Z,BI Analyst,"tableau, power bi",Not disclosed,2,False
Senior Financial Bi Analyst,Kaufman Rossin,India,,,"Why We Stand Out Seeking a new challenge where your professional and personal aspirations are not only possible but supported? Kaufman Rossin might be just the place for you! Kaufman Rossin Professional Services Private Limited’s (the “Company”) offices are located in the World Trade Center (WTC) in Bangalore, Karnataka, India, and at Udyog Vihar, in Gurgaon, Haryana, India. The Bangalore office provides a range of services, including risk management, corporate governance, tax, assurance, and f…",2026-03-13T15:31:25Z,BI Analyst,,Not disclosed,0,False
Reporting/Bi Analyst (Power Bi),Xoriant,"Pune, Maharashtra",,,"Job Description Job Title: Reporting/BI Analyst (Power BI) Role: FTE role Location: Pune (Hybrid) Experience: 5 to 8 years Job Description: Role Summary: Focuses on building and maintaining business critical reports and dashboards in Power BI using governed, analytics ready data models. Key Responsibilities: Build and maintain Power BI dashboards and reports Work closely with business stakeholders to gather and refine requirements Guide and challenge report designs and metric definitions Valida…",2026-04-10T05:29:40Z,BI Analyst,power bi,Not disclosed,1,False
Bi Analyst ( Power Bi & Python ),Crisil,"Pune, Maharashtra",,,"Oversee the maintenance and accuracy of the repository tool, ensuring compliance with internal standards. Lead the preparation of comprehensive, accurate reports for the S&P Onshore team within deadlines. Contribute to the development and enhancement of analytic platforms and visualizations, incorporating automation tools like RPA, Python, Power BI. Identify and implement process enhancements to improve efficiency and effectiveness in AQV Operations. Provide data support to the AQV analytical t…",2026-04-30T06:51:20Z,BI Analyst,"python, power bi",Not disclosed,2,False
Senior Data Bi Analyst,CBTS India,"Chennai, Tamil Nadu",,,"Job Purpose The Senior Data BI Analyst will be responsible for designing, implementing, and maintaining data solutions to support business intelligence initiatives across multiple departments, with an emphasis on product performance and strategic analytics. This role requires expertise in BI tools and cloud technologies to create scalable, interactive dashboards and data assets that empower data-driven decisions. Key Responsibilities Dashboard & Report Creation: Develop, maintain, and optimize …",2025-07-31T17:08:13Z,BI Analyst,,Not disclosed,0,False
Senior Bi Analyst - Quicksight,Trimble,"Chennai, Tamil Nadu",,,"We are seeking a highly motivated and experienced Senior BI Analyst to join our dynamic team. The ideal candidate will possess a strong analytical mindset, business acumen, and technical skillset to transform complex requirements into actionable insights through data discovery, transformation, analysis and dashboard development. A self-starter mindset, and excellent communication and organizational skills are essential, as this role bridges the gap between various stakeholders from business exp…",2026-05-28T06:53:43Z,BI Analyst,"excel, communication",Not disclosed,2,False
Senior Finance Bi Analyst,Bottomline,India,,,"Why Choose Bottomline? Are you ready to transform the way businesses pay and get paid? Bottomline is a global leader in business payments and cash management, with over 35 years of experience and moving more than $16 trillion in payments annually. We're looking for passionate individuals to join our team and help drive impactful results for our customers. If you're dedicated to delighting customers and promoting growth and innovation - we want you on our team! Senior Data Analyst – FP&A & Advan…",2026-05-17T02:21:15Z,BI Analyst,,Not disclosed,0,False
Data Analyst /Power Bi Analyst,Trigent Software Private Limited,"Richmond Town, Bangalore",1600000,1600000,"Data Analyst /Power BI Analyst Location: bengalore Exp: 6Yrs We are seeking a skilled Power BI Analyst to design and develop interactive dashboards and reports that deliver actionable insights. The role involves data modeling, DAX calculations, and integrating data from multiple sources to ensure accuracy and security. You will collaborate with stakeholders to translate business requirements into impactful visualizations, optimize performance, and support data-driven decision-making. Strong exp…",2026-05-22T22:29:10Z,BI Analyst,power bi,"1,600,000 - 1,600,000",1,True
Senior Bi Analyst (Tableau And Snowflake),Blend360,India,,,"Job Description As a Senior BI Analyst(Tableau), you'll transform raw data into stunning visual narratives that spark action and drive decisions across multiple regions and cross-functional teams. Collaborate with global clients, craft jaw-dropping dashboards, and lead end-to-end BI projects that deliver real business value. If you're passionate about turning insights into impact, thrive in a fast-paced consulting-style environment, and are excited about the future of AI-powered analytics — we …",2026-05-21T03:47:05Z,BI Analyst,"tableau, spark",Not disclosed,2,False
Senior Bi Analyst Tableau Expert,BMC Software Inc,India,,,Role Overview At BMC trust is not just a word its a way of life The company is recognized as an awardwinning equal opportunity culturally diverse and fun place to work The culture at BMC emphasizes giving back to the community and strives for continuous improvement As a member of the Analytics and Automation team you will play a crucial role in leveraging datadriven insights to enhance business performance across various departments Your work will involve developing designing and delivering dat…,2026-02-15T04:25:37Z,BI Analyst,,Not disclosed,0,False
Tableau Developer With Snowflake/ Bi Analyst,Central Business Solutions,India,,,"Duties & Responsibilities: Develop and maintain a deep understanding of our organization's business processes and data needs. Design and develop data models, dashboards, and reports to support business needs. Perform data analysis to identify trends, patterns, and insights that inform business decisions. Develop and maintain documentation, including data definitions, business rules, and data lineage. Help in establishing and implementing a robust data governance framework to ensure data quality…",2026-03-28T02:09:49Z,BI Analyst,,Not disclosed,0,False
"Senior Data & Bi Analyst (Ms Power Bi, Snowflake)",Franklin Templeton,"Hyderabad, Telangana",,,"At Franklin Templeton, we’re driving our industry forward by developing new and innovative ways to help our clients achieve their investment goals. Our dynamic and diversified firm spans asset management, wealth management, and fintech, offering many ways to help investors make progress toward their goals. Our talented teams working around the globe bring expertise that’s both broad and unique. From our welcoming, inclusive, and flexible culture to our global and diverse business, we offer oppo…",2026-05-08T02:08:29Z,BI Analyst,,Not disclosed,0,False
Power Bi Analyst Â Edtech (Uae Market),learners point.org,"Bangalore, Karnataka",400000,960000,"Power BI Analyst – EdTech (UAE Market) Location: Bangalore (Onsite) Working Days: 5 Days Industry: EdTech – Professional Training & Certification Programs Market Focus: UAE About Us – Learners Point Learners Point Academy is a leading professional training institute in the UAE, empowering working professionals and organizations through globally recognised certification programs such as CMA, PMP, ACCA, CIA, and other corporate training solutions. With a strong presence in the UAE market, we …",2026-02-26T11:27:11Z,BI Analyst,power bi,"400,000 - 960,000",1,True
Bi (Tableau) Analyst,GlobalLogic Inc,"Hyderabad, Telangana",,,"Job Description The Sr Analyst / Qlik and Data analysis expert is a well-rounded individual with knowledge of financial and business operational data, creating insightful dashboard to enable storytelling, data analytics, good communication, interpersonal, presentation and social skills. This role requires a consistent track record in supporting business operations functions and delivering insights based on data. Creates and enjoys being part of an environment that promotes customer centricity, …",2026-04-17T06:52:37Z,BI Analyst,communication,Not disclosed,1,False
Bi Reporting Analyst,Oracle,"Bangalore, Karnataka",,,"Qualifications & Previous Experience (This is a reporting analyst (IC3) role) Candidate should have min of 7 to 10 years of overall work experience and at least 3-4 years of BI reporting & operations experience is must! Should have complete excel related knowledge such as doing complex look up functions; execution of macros to handle data blending options Should have experience is handling executive ops reporting tasks ( Impact Analysis, Provide data Insights, Help decision making via data ) Sh…",2026-04-14T07:37:54Z,BI Analyst,excel,Not disclosed,1,False
Bi Developer - Analyst,Mitsubishi UFJ Financial Group,India,,,"Do you want your voice heard and your actions to count? Discover your opportunity with Mitsubishi UFJ Financial Group (MUFG), one of the world’s leading financial groups. Across the globe, we’re 150,000 colleagues, striving to make a difference for every client, organization, and community we serve. We stand for our values, building long-term relationships, serving society, and fostering shared and sustainable growth for a better world. With a vision to be the world’s most trusted financial gro…",2026-04-28T02:06:39Z,BI Analyst,,Not disclosed,0,False
Tableau Bi Sr Analyst,Blend360,India,,,"Job Description As a Senior BI Analyst(Tableau), you'll transform raw data into stunning visual narratives that spark action and drive decisions across multiple regions and cross-functional teams. Collaborate with global clients, craft jaw-dropping dashboards, and lead end-to-end BI projects that deliver real business value. If you're passionate about turning insights into impact, thrive in a fast-paced consulting-style environment, and are excited about the future of AI-powered analytics — we …",2026-05-21T03:47:04Z,BI Analyst,"tableau, spark",Not disclosed,2,False
Bi Reporting Analyst - Enterprise,Virtusa,"Hyderabad, Telangana",,,Key Responsibilities Connect to Greenplum DWH using tools like DBeaver or similar Develop reports and dashboards related to B2B sales revenue service performance and customer segmentation Analyze and interpret enterprise customer data to support marketing and sales strategies Build and automate dashboards using Power BI Tableau or MicroStrategy Work closely with Enterprise Sales Marketing and Customer Success teams to align reporting with business needs Identify data trends and provide actionab…,2026-04-12T07:09:25Z,BI Analyst,"tableau, power bi",Not disclosed,2,False
Bi Data Analyst - Chn,Photon Group,India,,,"Description Location: Chennai Experience: 6 - 9 Years The Purpose of This Role You will be responsible for conducting consultative analytics and creating executive level recommendations for business partners and line finance. You will also provide a broad range of ad hoc analytical support as needed. The analyses and insights delivered are critical components to drive business planning and ongoing decision making. The Value You Deliver Providing analyses and strategic recommendations to team, m…",2026-04-03T02:09:44Z,BI Analyst,,Not disclosed,0,False
Bi Reporting Analyst - Wholesale Business,Virtusa,"Hyderabad, Telangana",,,Key Responsibilities Connect to Greenplum DWH using tools like DBeaver or similar Prepare adhoc and scheduled reports for wholesale business performance interconnect revenues carrier traffic analysis and partnership metrics Design and maintain dashboards using Power BI Tableau or MicroStrategy Collaborate with Wholesale Sales Finance and Operations teams to identify and fulfill reporting needs Analyze large volumes of data and present findings in a clear and concise manner Maintain data integri…,2026-04-11T07:04:56Z,BI Analyst,"tableau, power bi",Not disclosed,2,False
Power Bi - Senior Analyst - Hyderabad,Deloitte,"Hyderabad, Telangana",,,"Software Engineer II Deloitte Technology works at the forefront of technology development and processes to support and protect Deloitte around the world. In this truly global environment, we operate not in ""what is"" but rather ""what can be"" to help Deloitte deliver and connect with its clients, its communities, and one another in ways not previously conceived. Work you'll do As a Software Engineer II on the Shared Services team, you will be responsible for: Analyzing business requirements for r…",2026-05-26T14:09:07Z,BI Analyst,,Not disclosed,0,False
Senior Analyst-Bi,WPP Media,"Bangalore, Karnataka",,,"About WPP Media WPP is the trusted growth partner for the world’s leading brands. With exceptional talent, trusted data and intelligence, and world-class partnerships – all united by our pioneering agentic marketing platform, WPP Open – we help clients navigate change, capture opportunity, and deliver transformational growth. WPP Media is WPP's AI-driven media operating unit, bringing together media, data, and partnerships to deliver creative personalisation at scale. Connected through WPP Open…",2026-03-27T02:13:08Z,BI Analyst,,Not disclosed,0,False
Bi Engineering Senior Analyst,Accenture,"Bangalore, Karnataka",,,"Job Description About The Role Skill required: Data Management - Data Analytics Designation: BI Engineering Senior Analyst Qualifications: Any Graduation Years of Experience: 5 to 8 years Technology and Operations services, and Accenture Song all powered by the world's largest network of Advanced Technology and Intelligent Operations centers. What would you do Data AIData Management involves the process of collecting, storing, organizing, and maintaining data. It ensures that data is accurate, …",2026-05-16T05:48:43Z,BI Analyst,,Not disclosed,0,False
