title,company,location,salary_min,salary_max,description,created,search_title,skills_found,salary_range,skill_count,has_salary
Data Analyst,Fuzen IT Solutions,"Hyderabad, Telangana",,,"Company Description Fuzen IT Solutions is a global leader in leveraging advanced machine learning, artificial intelligence, and data science to deliver transformative business results. With a strong presence across Europe, the UK, and the USA, the company also operates a scalable delivery hub in India, specializing in data science, artificial intelligence, and statistics. Established in 2018, the India facility serves global clients while offering corporate and professional training in data sci…",2026-05-08T08:21:09Z,Data Analyst,"machine learning, statistics",Not disclosed,2,False
Data Analyst,IBS Software,"Kochi, Ernakulam",,,Data Analyst (SQL Focus) - Immediate Joiners only Location : Kochi Experience : 6 to 9 years We’re looking for a detail-oriented and analytically driven Data Analyst to join our team! Key Responsibilities & Skills: • Strong experience with SQL for analyzing data across multiple data sources • Ability to build and manage data pipelines using SQL • Keen eye for identifying anomalies and data variances • Strong analytical thinking and problem-solving skills • Ability to quickly understand business…,2026-04-18T17:11:11Z,Data Analyst,sql,Not disclosed,1,False
Data Analyst,"Prudent Technologies and Consulting, Inc.","Hyderabad, Telangana",,,"Job Title: Data Analyst Job Role: The Data Analyst is responsible for highly analytical and detail-oriented analysis to collect, analyze, visualize, and interpret business data to support strategic decision-making. The ideal candidate should have 5 years of experience in data analysis, ETL processes, dashboard development and reporting using any visualization tools, preferably Power BI. Advance excel is must, combined with the ability to translate data into impactful business insights and recom…",2026-05-08T08:21:31Z,Data Analyst,"excel, power bi",Not disclosed,2,False
Data Analyst,Valkyrie People Consulting,India,,,"Job Title: Data Analyst Location: Pune, India Industry: Automotive Experience: 3 years of experience in data analysis, preferably within the automotive or manufacturing sector. Position Overview: The Data Analyst will be responsible for gathering, analyzing, and interpreting data to help the automotive company improve its operations, optimize supply chains, enhance customer satisfaction, and make informed business decisions. This role requires a strong background in data analysis techniques and…",2026-04-29T00:39:06Z,Data Analyst,,Not disclosed,0,False
Data Analyst,Bluo Software India LLP,"Mumbai, Maharashtra",,,"Job Title: Data Analyst Location: PAN India Experience: 2 Years Employment Type: Full-time Job Summary: We are seeking a detail-oriented Data Analyst with 2 years of experience in data analysis, reporting, and visualization. The ideal candidate should be proficient in SQL and have hands-on experience with visualization tools such as Tableau or Power BI. Exposure to Yellowfin BI will be considered an added advantage. Key Responsibilities: Analyze large datasets to extract meaningful insights and…",2026-05-10T08:53:54Z,Data Analyst,"sql, tableau, power bi",Not disclosed,3,False
Data Analyst,SimuLab,"Bangalore, Karnataka",,,"Company Description SimuLab is an innovative AI-native platform revolutionizing management education by replacing outdated case studies with dynamic, experiential learning through realistic business simulations. Driven by Agentic AI and no-code workflows, SimuLab immerses MBA students in real-time scenarios like supply chain crises and CRM automation. Based on fast-moving startup environments, these simulations prepare students for the complexities of modern business challenges. For educators, …",2026-04-29T08:44:02Z,Data Analyst,,Not disclosed,0,False
Data Analyst,Connext,"Jaipur, Rajasthan",,,"Data Analyst: Through collaborations with leading technology platforms, curate reports that offer insightful, consolidated, real-time views of all assets and liabilities, detailing what they are, who holds them, how ownership is divided, how they’re invested, and how they’re performing. These reports are strategically designed to uncover opportunities and highlight financial risks. Learn and leverage financial reporting and data aggregation tools: Conduct account level reconciliation. Provide a…",2026-04-25T07:56:28Z,Data Analyst,,Not disclosed,0,False
Data Analyst,PINKVILLA,"Mumbai, Maharashtra",,,"JD – Data Analyst Location: Mumbai Experience: 6–8 years Employment Type: Full-time About the Role We are looking for an experienced Data Analyst to drive data-backed decision-making across content, product, marketing, and business teams for our app. This role goes beyond reporting — it involves understanding user behaviour, identifying growth opportunities, and translating data into actionable insights that directly impact installs, engagement, retention, and revenue. This is a high-impact rol…",2026-04-23T17:44:21Z,Data Analyst,,Not disclosed,0,False
Data Analyst,EXL,"Bangalore, Karnataka",,,"Job Summary: We are looking for an experienced Data Analyst with a strong focus on advanced SQL and core analytics. The ideal candidate should have deep expertise in data querying, data analysis, and deriving actionable insights. This role is not suited for profiles primarily focused on dashboard development (Power BI/Tableau Developers). Key Responsibilities: Perform complex data analysis using advanced SQL queries. Extract, manipulate, and analyze large datasets to generate business insights.…",2026-04-21T07:38:20Z,Data Analyst,"sql, tableau, power bi",Not disclosed,3,False
Data Analyst,United Breweries Ltd.,"Bangalore, Karnataka",,,"Position: Data Analyst Location: Corporate Office, Bangalore Qualification: Graduate (Engineering/Statistics) /Post Graduate (MBA) Experience: 2-4 years of experience in business analytics and business intelligence Areas of Responsibility: 1) Business performance monitoring Identification of opportunities across Geography, Channel, Brand, Pack and provide insights on disruptive gain opportunities Monitoring and reporting of Width and depth of Distribution of focus brands 2) Insight generation a…",2026-05-07T16:23:31Z,Data Analyst,statistics,Not disclosed,1,False
Data Analyst,Keka HR,"Hyderabad, Telangana",,,"About Keka Keka is India’s 1 HR-Tech platform for SMBs, mid-market, and enterprise customers, now expanding aggressively across GCC and the US. Our unified SaaS platform powers everything from Core HR to Payroll, Talent, and Employee Experience for 10,000 customers. As we expand globally, Finance & Planning is becoming one of our most strategic pillars—enabling accurate payroll, compensation planning, budgeting, and workforce forecasting at scale. Overview We are seeking an AI enabled and dynam…",2026-05-10T08:46:24Z,Data Analyst,,Not disclosed,0,False
Data Analyst,Arcana,"Coimbatore, Tamil Nadu",,,"About Arcana Arcana is a portfolio intelligence platform used by hedge funds and asset managers to analyze performance and risk. We’re rethinking the tools institutional investors rely on—and we’re hiring analysts who want to help drive that transformation. Role Overview We are looking for a Data Analyst to work with large-scale financial datasets, ensure high data quality, and deliver actionable insights through dashboards and reports. The role focuses on building and maintaining robust data q…",2026-01-24T17:31:47Z,Data Analyst,,Not disclosed,0,False
Data Analyst,Sudhanand Group,"Bangalore, Karnataka",,,"About the Position Sudhanand group seeking a detail-oriented and analytical Data Analyst with expertise in Python, SQL, Excel, VBA, BI tools, and AI/ML techniques. The ideal candidate will have a solid background in data collection, processing, analysis, and visualization, along with the ability to apply machine learning and artificial intelligence methods to support data-driven decision-making across business functions. About the Role Key Responsibilities Collect, clean, and process structured…",2026-05-06T16:16:35Z,Data Analyst,"python, sql, excel, machine learning",Not disclosed,4,False
Data Analyst,LTM,"Mumbai, Maharashtra",,,"Role : Data Analyst Experience : 4-8 years Notice Period: Immediate to 15 days Location : PAN India Shift timings : 2-11 PM shift Key Skills: Advanced MS Excel/Data Validation/Data Analytics/Alteryx/SQL/Python Key Responsibilities Extract and analyse master and transactional data from SAP HANA backend systems using SQL queries. Retrieve and validate planning and forecast data from Anaplan models and modules. Perform data validation, reconciliation, and comparison between SAP HANA database and A…",2026-04-28T18:44:56Z,Data Analyst,"python, sql, excel",Not disclosed,3,False
Data Analyst,SII Group India,"Mumbai, Maharashtra",,,"Responsibilities Direct Responsibilities • Set up automated controls for document storage, tariff validation, invoice acquisition and accounting based on user requirements. • Act as specialist in one or more areas – tariff management, e-invoicing, fee-taxonomy reporting. • Manage workload – prioritize and organize tasks, recognize urgency and deliver on time. • Analyze and solve problems – proactively identify missing rate cards, mismatched fee taxonomy or invoice gaps and implement solutions. …",2026-05-07T16:23:30Z,Data Analyst,,Not disclosed,0,False
Data Analyst,Amicon Hub Services,"Mumbai, Maharashtra",,,"Client is a Business Intelligence (BI), Data Engineering, and Data Analytics platform company. It provides a full-stack analytics platform that helps enterprises and software companies turn raw data into reports, dashboards, predictive insights, and decision-ready intelligence. The company positions itself as a platform that can cover the end-to-end journey from data integration to analysis, with capabilities like self-service analytics, semantic modeling, reporting, dashboards, AutoML, predict…",2026-04-17T17:03:03Z,Data Analyst,,Not disclosed,0,False
Data Analyst,SourceFuse,"Noida, Ghaziabad",,,"SourceFuse is looking for a highly proactive and business-oriented Data Analyst (DOMO) with 6 years of experience who can go beyond reporting to drive insights, influence decisions, and shape scalable data-driven solutions for client. Preferred Location: Noida/Mohali This role requires someone who can: ● Lead stakeholder conversations ● Translate ambiguous business problems into structured analytical solutions ● Bring a strong understanding of financial analytics (budgeting, planning, cost anal…",2026-04-23T17:46:09Z,Data Analyst,,Not disclosed,0,False
Data Analyst,GreedyGame,"Bangalore, Karnataka",,,"About the Company : GreedyGame founded in 2013 by Arpit Jain [CEO] is a leading ad-tech company that's been driving app growth and monetization. b We’ve built a sustainable and profitable business for over 7 years without chasing vanity metrics and successfully completed our 0→1 journey, we’re now scaling rapidly (1→10 phase). b As a Google Publishing Partner, we serve 100M daily ad impressions and support 5,000 apps and games worldwide— delivering up to 75% revenue uplift. b Trusted by brands …",2026-04-16T15:10:13Z,Data Analyst,,Not disclosed,0,False
Data Analyst,Delivery Hero,India,,,"About Delivery Hero India: Delivery Hero India is part of Delivery Hero Group, the world’s leading local delivery platform. We operate in over 70 countries worldwide, powered by tech but driven by people. Headquartered in Berlin, Germany. Delivery Hero has been listed on the Frankfurt Stock Exchange since 2017 and is part of the MDAX stock market index. About the Role: We are looking for a data-driven professional with 2 to 4 years of experience to join our analytics team. As a Mid-Level Data A…",2026-05-13T18:57:52Z,Data Analyst,,Not disclosed,0,False
Data Analyst,GACS,India,,,"Job Details Location: Pune, India (Remote) Shift Timing: 3 PM IST to 12 AM IST / 4.30 AM to 1.30 PM EST Start Date: Early joiners preferred Compensation: 5 to 7 LPA About the Role We are seeking a detail-oriented and analytical Data Analyst to be a core contributor to our insights generation process. This role demands a deep technical aptitude for marketing data, a passion for efficiency through automation, and the ability to translate complex campaign performance metrics into clear, strategic …",2026-05-13T15:15:38Z,Data Analyst,,Not disclosed,0,False
Data Analyst,WebMD,"Navi Mumbai, Maharashtra",,,"About the Company: Headquartered in El Segundo, Calif., Internet Brands® is a fully integrated online media and software services organization focused on four high-value vertical categories: Health, Automotive, Legal, and Home/Travel. The company's award-winning consumer websites lead their categories and serve more than 250 million monthly visitors, while a full range of web presence offerings has established deep, long-term relationships with SMB and enterprise clients. Internet Brands' power…",2026-04-25T07:55:24Z,Data Analyst,,Not disclosed,0,False
Data Analyst,Aurolab,"Madurai, Tamil Nadu",,,"Job Description: As a BI Developer focused on Tableau, I support the organization by transforming raw data into meaningful insights. I assist in the development of dashboards and reports that aid in monitoring business performance, identifying trends, and enabling data-driven decisions. I work with cross-functional teams to ensure timely and accurate data visualization while contributing to the overall analytics capability of the organization. Key Responsibilities Design, develop, and maintain …",2026-04-17T17:06:42Z,Data Analyst,"tableau, data visualization",Not disclosed,2,False
Data Analyst,Midtown Software,"Chandigarh, India",,,"The ideal candidate will use their passion for big data and analytics to provide insights to the business covering a range of topics. The main field of Analysis will be the data on NatGasHub.com and the Energy Industry of the US and Canada. Timings-9:00 am to 6:00 pm Direct exposure to working with U.S. and Canadian clients. Responsibilities Understand the day-to-day issues that our business faces, which can be better understood with data Coordinate with the team to complete tasks Making sure t…",2026-02-18T15:46:18Z,Data Analyst,,Not disclosed,0,False
Data Analyst,Pice®,"Bangalore, Karnataka",,,"Description About the Role We're looking for an analyst who thinks from first principles and builds things that last. You'll sit at the intersection of credit policy, product analytics, and growth — owning the pipeline from raw data to dashboards to the insights that improve decisions. This isn't a reporting role. You'll partner directly with credit, product, and growth teams to diagnose funnel drop-offs, surface policy blind spots, and build the analytical infrastructure that makes better deci…",2026-05-06T16:14:32Z,Data Analyst,,Not disclosed,0,False
Data Analyst,SMC Squared India,India,,,"Key Responsibilities Design, develop, and implement solutions using Salesforce CRM and Sales Cloud Build and maintain Salesforce Analytics (CRM Analytics/Tableau CRM) dashboards and lenses Develop complex SAQL queries and SAQL bindings to support dynamic dashboards and advanced analytics Analyze business requirements and translate them into technical solutions Design and manage ETL processes for data extraction, transformation, and loading from various data sources Integrate Salesforce with ext…",2026-05-07T16:26:48Z,Data Analyst,tableau,Not disclosed,1,False
Data Analyst,Tata Consultancy Services,"Chennai, Tamil Nadu",,,"Responsibilities Strong SQL skills for data extraction, joins, aggregations, and performance tuning. Python proficiency for data manipulation, statistical analysis, and automation (Pandas, NumPy, Scikit‑learn preferred). Solid experience in Power BI dashboard development , DAX measures, and data modeling. Understanding of predictive analytics, regression models, time‑series forecasting , and machine learning basics. Strong analytical mindset with excellent problem‑solving skills. Experience wit…",2026-04-22T17:40:27Z,Data Analyst,"python, sql, excel, power bi, machine learning, pandas, numpy",Not disclosed,7,False
Senior Data Analyst,MS CLINICAL RESEARCH,"Bangalore, Karnataka",,,"Job Title: Senior Data Analyst – Team Lead Experience: 8 Years Department: Data Analytics / Clinical Data Analytics Location: Domlur, Bangalore Reporting To: Director Role Overview We are seeking an experienced Senior Data Analyst – Team Lead to oversee data analytics operations, lead a team of analysts, and ensure delivery of high-quality, data-driven insights. The role requires strong leadership, project management, and hands-on analytical capabilities, particularly in handling clinical/study…",2026-04-22T23:41:06Z,Data Analyst,,Not disclosed,0,False
Compliance Data Analyst,Mashreq,India,,,"Job Summary We are seeking a highly skilled Data Analyst to support the Transaction Monitoring System Analytics Manager with both BAU and ad‑hoc analytical initiatives. This role will focus on developing, optimizing, and automating compliance data analytics, MIS, and regulatory reporting to support AML, sanctions, and correspondent banking oversight. The ideal candidate combines strong SQL development skills, advanced Excel/VBA automation, and a solid understanding of compliance data requiremen…",2026-05-05T08:12:45Z,Data Analyst,"sql, excel",Not disclosed,2,False
Senior Data Analyst,Beebom,"Noida, Ghaziabad",,,"Beebom is hiring a Senior Data Analyst for our in-house Tech team to work on our new product, Beebom’s Gadgets. In this role, you will own the analytics function end-to-end — from data exploration to driving measurable business impact. You’ll take ownership of analyzing data, understanding user behavior, and tracking product performance to guide data-driven decisions across the organization. You will be responsible for collecting, organizing, analyzing, and visualizing data, ensuring it is accu…",2025-11-20T08:19:15Z,Data Analyst,,Not disclosed,0,False
Data Analyst Trainer,Arbor Academy,India,,,"Job Title: Data Analyst Trainer (5–10 Years Experience) Location: Bhubaneswar About the Company: Arbor Academy is a career-focused training institute offering industry-oriented programs in Data Analytics, Data Science, and IT domains. The institute emphasizes hands-on learning, real-time projects, and placement support to make students job-ready. Role Overview: We are looking for an experienced Data Analyst Trainer to deliver high-quality training programs aligned with industry standards. The t…",2026-04-20T17:32:06Z,Data Analyst,,Not disclosed,0,False
Marketing Data Analyst,BIG Language Solutions,India,,,"Job Title: Marketing Data Analyst Experience Required: 3 years Location: India (Remote) Travel required: Occasional Reports to: VP, Marketing & Sales Enablement Employment Type: Full-Time Goal of Position: The Marketing Analyst will provide dedicated support for marketing data, reporting, and analysis across campaigns, RFPs, and business initiatives. This role will act as the primary steward of marketing data, ensuring that information is accurate, consistent, complete, and fit for use across r…",2026-05-01T17:01:01Z,Data Analyst,,Not disclosed,0,False
Senior Data Analyst,Dreampath Services,India,,,"Job Role :: Senior Data Analyst Location : Pune Job Type : C2h R&R Conduct impact assessment of the Veeva-to-Salesforce migration for enterprise field reporting Maintain a centralized tracker for all issues, change requests, and resolutions; provide regular status updates and proactively flag risks to project team Coordination with IT team for issue resolution Document migration activities, decisions, and changes in plain business language, structured for sharing across all impacted stakeholder…",2026-05-10T00:43:53Z,Data Analyst,,Not disclosed,0,False
Senior Data Analyst,Epsilon,"Bangalore, Karnataka",,,"Senior Data Analyst Data Analytics : Overview About Business Unit: Powerful predictors of the future - our Analytics team seamlessly blends data science and business intelligence to provide unparalleled foresight for our platform offerings. They turn insights into actionable results for our clients by collaborating with senior team members and staying ahead of market trends, powered by our data assets. By using new-age analytic tools and emerging technologies, the team cultivates a dynamic lear…",2026-04-22T23:44:52Z,Data Analyst,,Not disclosed,0,False
Grm Data Analyst,AB InBev GCC India,"Bangalore, Karnataka",,,"AB InBev GCC was incorporated in 2014 as a strategic partner for Anheuser-Busch InBev. The center leverages data and analytics to drive growth for critical business functions such as operations, finance, people, and technology. The teams are transforming Operations through Tech and Analytics. Do You Dream Big? We Need You. Job Description Job Title: GRM Data Analyst Location: Bengaluru Reporting to: Senior Program Manager 1. PURPOSE OF THE ROLE : You will be a part of AB InBev’s Global Risk Man…",2026-04-25T07:55:54Z,Data Analyst,,Not disclosed,0,False
Marketing Data Analyst,Cava Athleisure,India,,,"Role Overview As a Data Analyst for Marketing at Cava Athleisure , you will play a critical role in enabling data-driven growth across our direct and third-party sales channels. This role sits at the intersection of marketing, marketplaces, and business strategy, with ownership of turning complex, multi-source data into clear insights that directly influence spend efficiency, conversion, retention, and scale. Key Responsibilities 1. Data Integration & Infrastructure Integrate and manage data fr…",2026-04-30T14:49:46Z,Data Analyst,,Not disclosed,0,False
Metrics & Data Analyst,Tech Mahindra,"Noida, Ghaziabad",,,"Job Title: Metrics & Data Analyst Years of Experience: 8-12 years of experience in metrics analysis, KPI definition, and dashboard development. Location: Bengaluru/Pune/Hyd/Chennai/Noida Educational Qualification Bachelor's degree in engineering, Statistics, Mathematics, Computer Science, or a related field. Certifications in Data Analytics, Quality Management, or Process Excellence are advantageous. Skill Requirements Deep understanding of data, metrics, and KPIs, with the ability to define me…",2026-04-21T17:30:19Z,Data Analyst,"excel, statistics",Not disclosed,2,False
Senior Data Analyst,Tanla Platforms Limited,"Hyderabad, Telangana",,,"Role Overview We are looking for a Data Analyst to collect, process, and analyze data to help drive informed business decisions. The ideal candidate will have strong analytical skills, experience with data tools, and the ability to translate complex data into actionable insights Key Responsibilities: Collect, clean, and validate data from multiple sources Analyze large datasets to identify trends, patterns, and anomalies Develop dashboards, reports, and visualizations for stakeholders Write eff…",2026-05-14T01:01:45Z,Data Analyst,,Not disclosed,0,False
Lead Data Analyst,Nath Outsourcing Solutions Pvt. Ltd.,India,,,"Experience Required: 5–7 Years Role Overview We are looking for a Lead Data Analyst who excels at turning data into meaningful insights that drive business decisions. This role is primarily focused on analytics, visualization, stakeholder collaboration, and storytelling , rather than heavy data engineering. The ideal candidate will have strong expertise in SQL, Excel, Power BI, and Tableau , along with the ability to understand business problems deeply and translate them into actionable insight…",2026-05-07T16:21:39Z,Data Analyst,"sql, excel, tableau, power bi",Not disclosed,4,False
Portfolio Data Analyst,Arcana,India,,,"We are seeking dynamic Portfolio Data Analysts to join our team and collaborate closely with our founders, financial analysts, product managers, and engineers. In this role, you'll play a pivotal part in supporting our client onboarding and success team. You'll need a strong ability to analyze financial data, translate insights into actionable strategies, and effectively guide clients through our platform's features to drive their success. Responsibilities: Analyze and onboard portfolio data fr…",2025-12-10T19:02:09Z,Data Analyst,,Not disclosed,0,False
Senior Data Analyst,Hevo Data,"Bangalore, Karnataka",,,"About Hevo: Hevo ( www.hevodata.com ) is a simple, intuitive, and powerful No-code Data Pipeline platform that enables companies to consolidate data from multiple software for faster analytics. Hevo powers data analytics for 2000 data-driven companies across multiple industry verticals, including Cult.fit, Postman, ThoughtSpot, Jawa Motorcycles. By automating complex data integration tasks, Hevo allows data teams to focus on deriving groundbreaking insights and driving their businesses forward.…",2026-05-01T23:02:29Z,Data Analyst,,Not disclosed,0,False
Junior Data Analyst,Havas Creative Network,"Mumbai, Maharashtra",,,"We're looking for a curious, data-driven analyst to join our customer experience practice. You'll turn raw data into clear insights that shape how our clients communicate, engage, and grow — working across our own datasets and theirs to drive real business impact. Three Core Pillars 01 Data-driven value delivery Using internal and client datasets to generate insights across business, communications & CX use cases. 02 Reporting & pipelines Maintaining and building scalable reporting pipelines th…",2026-05-13T18:57:24Z,Data Analyst,communication,Not disclosed,1,False
