title,company,location,salary_min,salary_max,description,created,search_title,skills_found,salary_range,skill_count,has_salary
Data Analyst,Sagility,India,,,"Sagility combines industry-leading technology and transformation-driven BPM services with decades of healthcare domain expertise to help clients draw closer to their members. The company optimizes the entire member/patient experience through service offerings for clinical, case management, member engagement, provider solutions, payment integrity, claims cost containment, and analytics. Sagility has more than 25,000 employees across 5 countries. ""To conduct data analysis, provide insights, and c…",2025-12-07T22:44:33Z,Data Analyst,,Not disclosed,0,False
Data Analyst,EWU,"Coimbatore, Tamil Nadu",400000,700000,"We’re seeking a detail-oriented Data Analyst with proven experience in corporate settings to transform raw data into actionable insights. You’ll collaborate across departments to support strategic decision-making, optimize operations, and enhance business performance through data-driven analysis. Skills:- PowerBI, Tableau, Data Analytics, Dashboard, MS-Office, Data Visualization and Advanced analytics",2025-08-04T05:33:07Z,Data Analyst,"tableau, data visualization","400,000 - 700,000",2,True
Business Analyst,Eurofins GSC IT DC,"Bangalore, Karnataka",,,"Job Description Basic Function and Scope of Responsibility: The IT Business Analyst supports the organization by assessing the impact of requested changes, capturing and documenting requirements, and ensuring that those requirements are delivered by IT. In addition, the Business Analyst is responsible for the documentation and execution of test plans for the delivered functionality while supporting the business through the implementation process. Business Analysis is part of the Software Develo…",2026-05-23T09:53:44Z,Business Analyst,,Not disclosed,0,False
Business Analyst,Weekday AI,India,,,This role is for one of the Weekday's clients Salary range: Rs 600000 - Rs 1000000 (ie INR 6 - 10 LPA) Experience: 4 yrs Location: Visakhapatnam Job Type: full-time Requirements Key Responsibilities: Collaborate with stakeholders to gather and document business needs and requirements. Work with stakeholders to maintain and prioritize the requirements backlog. Convert business requirements into comprehensive user stories and acceptance criteria. Ensure the engineering team fully comprehends the …,2026-05-15T15:49:57Z,Business Analyst,,Not disclosed,0,False
Business Analyst,E2logy Software Solutions Private Limited,"Ambawadi Vistar, Ahmedabad",,,"We are looking for a Business Analyst who will work closely with clients and internal teams to understand requirements, especially during presales and project discussions. The role involves gathering client needs, preparing clear documentation, and supporting the team in delivering the right solution. Responsibilities: Understand client requirements during presales calls, meetings, and discussions. Work with clients to gather and clarify business needs. Prepare simple and clear documents such a…",2026-05-30T00:33:55Z,Business Analyst,,Not disclosed,0,False
Business Analyst,SuperProcure,"Kolkata, West Bengal",,,"Job Title : JD 35 _ Business Analyst Department : Operations & Project Management Location : Kolkata (On-site) Please Note - People with more than 3 years of experience, kindly refrain from applying for this position. Job Summary SuperProcure is looking for Business Analyst with organizational, management and problem-solving skills. We are seeking a high level of motivation, a self- starter attitude, and the ability to work with minimal direction and supervision. The ideal candidate will be hel…",2026-04-25T10:40:51Z,Business Analyst,,Not disclosed,0,False
Business Analyst,Delta Exchange,India,,,"We are seeking a dynamic and detail-oriented Business Analyst to join our team. The ideal candidate will have 2–5 years of experience and a strong analytical mindset to solve complex business problems. Proficiency in SQL, Tableau, R, and Python (advanced preferred), along with an ability to derive actionable insights, is essential for this role. Key Responsibilities ● Data Analysis and Insights: Analyze complex datasets to provide actionable insights for business growth and operational efficien…",2026-03-24T13:18:10Z,Business Analyst,"python, sql, tableau",Not disclosed,3,False
Business Analyst,CCTECH,"Warje, Pune",100000,150000,"We are seeking a high-performing Senior Business Analyst – Strategy, Growth & Transformation to support strategic growth initiatives, enterprise-wide transformation programs, and business excellence across diversified business verticals. This role is designed for a commercially astute and analytically strong professional who can identify growth opportunities, solve complex business challenges, enhance operational efficiency, and partner with leadership teams to deliver measurable business outco…",2026-05-12T02:19:55Z,Business Analyst,excel,"100,000 - 150,000",1,True
Business Analyst,Arena Investors I Quaestor Advisors,India,,,"Quaestor is looking to expand the Technology Team through the addition of Data Integrity associate. In this role, the individual will reconcile and ensure the accuracy of the data used by Quaestor’s teams. KEY RESPONSIBILITIES Work closely with the Operations Team and IT Team to monitor data within the Arena Data Warehouse and Arena proprietary pipeline software. Reconcile data within the Arena Data Warehouse and pipeline to ensure accuracy. Create additional data reconciliations as required. W…",2025-06-27T20:21:10Z,Business Analyst,,Not disclosed,0,False
Business Analyst,"Opalforce, Inc.","Bangalore, Karnataka",,,"About the Job: Opalforce is hiring Mechanical Design Engineers Key Responsibilities: Create requirements and specifications for business solutions Conduct business analysis and research to identify opportunities for improvement Consult with key stakeholders to determine business objectives and success factors Collaborate with team members to collect, analyze, and evaluate information from multiple sources including Present findings and recommendations to stakeholders Write and document business…",2024-06-07T16:37:08Z,Business Analyst,,Not disclosed,0,False
Business Analyst,Lincode Labs India Pvt Ltd,"Bangalore, Karnataka",400000,800000,"Job Description: Business Analyst (Job Code: BNSAN1) No of Positions: 2 Purpose of Position: Requirements management is one of the core skills of business analysts. Developing technical solutions to business problems, or to advance a company’s sales efforts, begins with defining, analyzing and documenting requirements. Managing requirements at the project level can help fulfill business needs. Skilled business analysts also use requirements to drive the design or review of test cases, process c…",2020-03-31T19:47:07Z,Business Analyst,,"400,000 - 800,000",0,True
Business Analyst,Yes Bank Limited,"Mumbai, Maharashtra",,,Here's a draft for your job posting for the Business Analyst role in the Business and Digital Technology Solutions Group: Job Posting: Business Analyst Department: Business and Digital Technology Solutions Group Sub Unit: OSD Transformation Role: Business Analyst Location: Mumbai Grade: Manager/Assistant Manager Team Leader / Individual Role: Individual Role Number of Openings: 1 Reporting Manager: Farida Saher Reviewer: Kamlesh Haria Position Summary: We are seeking a motivated and dynamic…,2026-04-18T06:52:23Z,Business Analyst,,Not disclosed,0,False
Business Analyst,ProPMO Services Private Limited,"Bangalore, Karnataka",400000,800000,"Hiring: Business Analyst – General / Motor Insurance Domain Location: Bangalore, Walton Road Experience: 4-5 years in the General Insurance Industry (Motor Insurance vertical) We are looking for a Business Analyst with expertise in Motor Insurance to join our team. If you have a strong understanding of the insurance sector and analytical skills, we’d love to connect! Skills:- Business Analysis, General Insurance and Business Analyst",2025-02-07T12:24:34Z,Business Analyst,,"400,000 - 800,000",0,True
Business Analyst,xyz,"Tamil Nadu, India",,,"A Business Analyst job description typically includes: Creating a detailed business analysis, outlining problems, opportunities and solutions for a business Budgeting and forecasting Planning and monitoring Financial modelling Variance Analysis Pricing Reporting Defining business requirements and reporting them back to stakeholders In addition to performing financial and operational modelling, a Business Analyst is expected to develop new models that underpin sound business decisions. A Busines…",2024-07-31T03:13:45Z,Business Analyst,,Not disclosed,0,False
Business Analyst,EXL,India,,,Description BA/APO- Asset Management Responsibilities BA/APO- Asset Management Qualifications Business Analyst: Graduate Business Analyst: 4 years,2026-05-30T02:24:33Z,Business Analyst,,Not disclosed,0,False
Business Analyst,Wissen Technology,"Hyderabad, Telangana",,,"· 5 years of experience as a Product Specialist, Business Analyst, or any other occupation/title providing experience with business process and data analysis · Proven experience with and understanding of relational databases, and ability to construct basic to intermediate query logic · 2 years of experience in asset management and/or fintech domain in R&D or product capacity Skills:- Business Analyst, Asset management, SQL and Data Analysis",2025-08-05T08:19:57Z,Business Analyst,sql,Not disclosed,1,False
Business Analyst,,"Noida, Ghaziabad",,,"We are hiring a Business Analyst to join our project team. You will work alongside other business analysts and report directly to the project manager. Your main tasks will include performing detailed requirements analysis, documenting processes, and performing some user acceptance testing. To succeed in this role you should have a natural analytical way of thinking and be able to explain difficult concepts to non-technical users.",2024-05-10T07:39:01Z,Business Analyst,,Not disclosed,0,False
Business Analyst,PopcornApps,"Hyderabad, Telangana",200000,1000000,Business Analyst Business Analyst at PopcornApps is focused on customer business process understanding for the enterprise software solutions developed at PopcornApps. This role serves as a facilitator for all areas related to Business Process understanding and its communication through written and verbal medium. Business Analyst ensures communication of project requirements to the technical development team. Candidate Profile: 3 Years Experience. The candidate can be a project lead or an indivi…,2022-05-25T05:32:48Z,Business Analyst,communication,"200,000 - 1,000,000",1,True
Business Analyst,Presidency University,"Bangalore, Karnataka",,500000,"Job Description We are hiring a Business Analyst to join our project team. You will work alongside other business analysts and report directly to the project manager. Your main tasks will include performing detailed requirements analysis, documenting processes, and performing some user acceptance testing. To succeed in this role, you should have a natural analytical way of thinking and be able to explain difficult concepts to non-technical users. Business Analyst Responsibilities: Evaluating bu…",2020-10-29T02:45:11Z,Business Analyst,,Not disclosed,0,False
Business Analyst,Accenture India,"Kolkata, West Bengal",,,"Job Description Project Role : Business Analyst Project Role Description : Analyze an organization and design its processes and systems, assessing the business model and its integration with technology. Assess current state, identify customer requirements, and define the future state and/or business solution. Research, gather and synthesize information. Must have skills : GuideWire Integration Good to have skills : NA Minimum 5 year(s) of experience is required Educational Qualification : 15 ye…",2026-04-10T06:59:06Z,Business Analyst,,Not disclosed,0,False
Business Analyst,Ebizz Infotech,"Surat, Gujarat",120000,300000,"We are hiring a business analyst to join our project team. You will work alongside project stakeholders and report directly to Sr. Business analysts. The purpose of the role is to liaison and bridge the gap between the BDM team and technical team to comprehend and analyze customer requirements and translate them to the development teams thereby, ensuring the right requirement detail in the documentation. To succeed in this role, you should have a natural analytical way of thinking and be able t…",2023-02-04T06:16:41Z,Business Analyst,,"120,000 - 300,000",0,True
Business Analyst,Mithra Global,"Mumbai, Maharashtra",1200000,1300000,"Business Analyst responsibilities are:  A business analyst serves as a liaison between developers and users, clients, management and IT.  Using IT resources at an advanced level to create IT solutions, enabling organiastion meet their goals  Understanding data formats and translating them to useful process inputs.  Understanding calculation logic and interacting with the clients on their queries  Good knowledge of subject matter – both Finance and IT  Doing product demonstrations internal…",2022-11-22T05:54:55Z,Business Analyst,,"1,200,000 - 1,300,000",0,True
Business Analyst,Novrelease,India,35000,50000,"We are looking for a Business Analyst who will be the vital link between our information technology capacity and our business objectives by supporting and ensuring the successful completion of analytical, building, testing, and deployment tasks of our software product’s features. Business Analyst responsibilities include: Defining configuration specifications and business analysis requirements Performing quality assurance Defining reporting and alerting requirements Job brief We are looking for…",2026-02-18T08:20:34Z,Business Analyst,,"35,000 - 50,000",0,True
Business Analyst,Redfoxa Careerlink Pvt Ltd,"Bangalore, Karnataka",400000,450000,"Title: Business Analyst – Fresher Company: Concentrix Location: Bangalore CTC: ₹4 – ₹4.8 LPA Job Description: We are hiring Business Analysts for Concentrix, Bangalore. This is a great opportunity for fresh graduates to start their IT career in a professional corporate environment. Key Responsibilities: Analyze business requirements and processes Coordinate with internal teams and stakeholders Support data analysis and reporting Ensure smooth project execution Eligibility Criteria: Any Graduate…",2026-05-05T12:11:01Z,Business Analyst,,"400,000 - 450,000",0,True
Business Analyst,Vision Infotech,"Surat, Gujarat",,,"Description We are looking for a skilled Business Analyst to join Vision Infotech, a leading IT company. As a Business Analyst, you will play a crucial role in analyzing business processes, identifying areas for improvement, and recommending solutions to enhance efficiency and productivity. Your insights will be instrumental in driving strategic decision-making and ensuring the successful implementation of projects. Working at Vision Infotech, you will be involved in a variety of projects aimed…",2025-11-20T00:58:11Z,Business Analyst,,Not disclosed,0,False
Business Analyst,Texila American University,"Coimbatore, Tamil Nadu",,700000,"Title : Business Analyst Reporting to : Project Manager Work Location : Coimbatore, TN Summary : As a Business Analyst, he/she will be working as a member of product development team who analyzes the business domain, documents its processes and systems, outlines business requirements, and matches a software business model with the software being built. You will be bridging the gap between stakeholders and the development team, interpreting business requirements into understandable development t…",2021-11-04T03:52:47Z,Business Analyst,,Not disclosed,0,False
Business Analyst,In Touch,"Hyderabad, Telangana",,,"About the Job The Business Analyst plays a key role in enhancing customer interaction experiences and operational efficiency. This position focuses on analyzing user behavior, optimizing interaction flows, and supporting the design and continuous improvement of automated, user-facing solutions. The role bridges business needs with technical execution, ensuring solutions are intuitive, scalable, and aligned with user expectations. Through close collaboration with cross-functional teams, the Busi…",2026-05-28T02:24:38Z,Business Analyst,,Not disclosed,0,False
Business Analyst,Refining Skills Academy,"Bangalore, Karnataka",420000,600000,"Business Analyst Yelahanka, Bangalore About the Role We are hiring a Business Analyst to work closely with founders and business teams on real operational challenges. This role focuses on turning data into actionable insights and driving business decisions across industries. Key Responsibilities Analyze data to identify trends, gaps, and opportunities Convert insights into actionable business recommendations Build dashboards using Power BI and Excel Work on process improvements and operational …",2026-05-26T06:36:53Z,Business Analyst,"excel, power bi","420,000 - 600,000",2,True
Business Analysts,Money Honey Financial Services Private Limited,"Mumbai, Maharashtra",300000,1000000,"Job brief We are looking for a Business Analyst to help us to build our online-only investment platform, which will enable investors to easily invest in mutual funds from leading fund houses in India, corporate fixed deposits, and various other investment products. Another important activity where Business analyst will help us is that to keep a track on different asset class and keep them updated in system. Which will help us to do financial planning for the investor. Business Analyst Desk - JD…",2024-06-28T10:26:34Z,Business Analyst,,"300,000 - 1,000,000",0,True
Business Analyst,Sigma Infosolutions,"Bangalore, Karnataka",1200000,1500000,"Job Description of Business Analyst About the job: We are looking for a Business Analyst for E-commerce domain (Magento) Role: Your role will be of Business Analyst Location: Bangalore · Requirement Collection, Documentation and Analysis for existing and new projects · Propose reasonable solution to client’s requirement in alignment with technical & budget feasibility. · Bring clarity in work scope between development team & client. · Leading and managing multiple projects end to end. · Client …",2022-06-28T06:28:21Z,Business Analyst,,"1,200,000 - 1,500,000",0,True
Business Analyst,Acura Solution,"Delhi, India",,,"Job Description: Business Analyst Proven experience in government consulting, large-scale IT project documentation, and business process analysis Proficiency in tools like MS Visio, Draw.io, JIRA, Confluence, Excel, PowerPoint Knowledge of SDLC, Agile, and Waterfall methodologies Familiarity with India Stack components and digital public infrastructure is an advantage Understanding of data privacy, security policies, and accessibility guidelines 5 years of experience as a Business Analyst, pref…",2026-05-14T02:25:13Z,Business Analyst,excel,Not disclosed,1,False
Business Analyst,NatWest Group,"Gurgaon, Haryana",,,"Join us as a Business Analyst This is an opportunity for a driven Business Analyst to join us and make a tangible impact on our function You'll have great exposure to a wide network of stakeholders of varying seniority It's a chance to develop your skills and advance your career in this fast paced role We're offering this role at associate level What you'll do You'll support the bank to achieve customer advocacy by eliciting and understanding the internal and external technology customer needs,…",2026-04-23T06:58:07Z,Business Analyst,,Not disclosed,0,False
Business Analyst,AVIGNAAI PRIVATE LIMITED,"Baner, Pune",,,"Dear Candidate, Hope you are doing well. I'm thrilled to connect with you today and share an exciting opportunity at Avigna.AI for the role of Business Analyst . Avigna.AI is not just a workplace; it's a dynamic hub of innovation and collaboration, and we're seeking talented individuals to join our team. Please find below the job description : Requirement: Business Analyst, Avigna, Pune LinkedIn link : Avigna.AI Job Location: Pune, Baner. Work from Office, Monday to Friday, 9:30 AM to 6:30 PM. …",2026-05-28T07:05:10Z,Business Analyst,,Not disclosed,0,False
Business Analyst,Ixora Global Services,"Gurgaon, Haryana",12,144,"Business Analyst I JD for ‘Business Analyst - I’ Resource Experience Required - 6 to 8 years Location - India Summary The ‘Business Analyst’ works closely with the business and technical teams. This role is a major contributor to the requirements specification deliverable, writes the business and functional requirements and ensures the analytical, build, test and deployment tasks related to both internally developed as well as third party solutions are successfully completed. Performs feasibili…",2019-06-05T21:12:02Z,Business Analyst,,12 - 144,0,True
Business Analyst,Black Turtle,"Bangalore, Karnataka",,,"Role & responsibilities Business Analyst, Business Analysis, Requirement Gathering, Change Management. Transformation, wholesale banking or Retail Banking, Basel -III,IV, Credit risk, IFRS 9, IFRS. Capital Markets, Global markets, Investment Banking, etc. Skills: Business Analysis, Investment Banking, Retail Banking, Credit Risk, Capital Market, Change Management, Requirement Gathering Experience: 10.00-20.00 Years",2026-04-30T06:48:55Z,Business Analyst,,Not disclosed,0,False
Business Analyst,NeoGenCode Technologies Pvt Ltd,India,1000000,2200000,"Position : Business Analyst Experience : 5 Years Location : Remote Notice Period : Immediate Joiners Preferred (or candidates serving 10–15 days’ notice) Interview Mode : Virtual Job Description : We are seeking an experienced Business Analyst with a strong background in requirements gathering, functional documentation, and stakeholder management, particularly in the US Healthcare payer domain . Mandatory Skills : Business Analysis, US Healthcare Payer Domain, Requirement Gathering, User Storie…",2025-06-18T05:21:07Z,Business Analyst,,"1,000,000 - 2,200,000",0,True
Business Analyst,Whitefield Careers,"Pune, Maharashtra",,,"Business Analyst Location: Pune [Work from Office] Employment Type: Full-time Job Overview As a Business Analyst at Organisation, you will play a critical role in bridging the gap between business needs and technology solutions. You will collaborate with stakeholders, gather requirements, analyze business processes, and work closely with the development team to enhance our legal tech solutions. This role requires strong analytical skills, problem-solving abilities, and a keen understanding of s…",2026-02-17T08:22:27Z,Business Analyst,,Not disclosed,0,False
Business Analyst,ADCI MAA 15 SEZ - K20,"Chennai, Tamil Nadu",,,"Within the Selection Monitoring team, a Business analyst is expected to own analytics on large volumes of data, synthesize the analysis into business insights, communicate the findings to stakeholders and and deliver business value. Business analyst will be expected to be skilled in understanding customer needs, converting them to analysis requirements, having working knowledge of data availability in various sources, building customer confidence through effective communication and derive recom…",2026-03-07T11:22:07Z,Business Analyst,communication,Not disclosed,1,False
Business Analyst,Idexcel,"Hyderabad, Telangana",,,"Job Description Dear Candidates , Greetings from IDEXCEL Technologies Please find the employment opportunity with I dexcel, and acknowledge asap forfurther interview process. Please do share updated CV Designation:Business Analyst- Commercial Lending Company Name: IDEXCEL technologies, Full Time. Experience: 5 Years Notice Period: immediate to 1 Month Work Mode: Work From Office( 5 Days in a week) Interview Mode: 1 St Level will be online, 2 nd Level Will be F2F. Work Locations: Hyderabad( Punj…",2026-05-12T05:45:41Z,Business Analyst,excel,Not disclosed,1,False
Business Analyst,MM Staffing & Career Consultants,"Bangalore, Karnataka",,,"Job Description: Job Description Position: Business Analyst, Securities Services Location: Bangalore/ Remote/ Hybrid Job Type: 9 month Contract Notice Period: Immediate to 15 days CTC : 3.5 lakh per month Principle Responsibilities: The Business Analyst will be a liaison between technology, operations, and various business units to lead and facilitate the creation and specification of business requirements regarding a new digital platform for Securities Services. The Business Analyst is expecte…",2026-05-13T02:03:54Z,Business Analyst,,Not disclosed,0,False
Business Analyst,Forerunner Consultancy Services,"Pune, Maharashtra",,,For the Role of a Business Analyst(BA). An excellent opportunity with MNC for the candidates with the experience in F&A (AP-AR-GL) domain knowledge on platforms Oracale 11i EBS and SAP FICO. Mail your profiles to forerunnerpune@gmail.com,2025-01-18T17:37:54Z,Business Analyst,excel,Not disclosed,1,False
Business Analyst,Topcoder,"Noida, Ghaziabad",,,"Looking for a Business analyst -.MBA (preferably) Good communication skills Understanding of analytics requirement gathering Good understanding of supply chain or procurement domain knowledge Basics of how a Power BI dashboard should be designed & developed, good in Excel.",2025-07-31T17:07:34Z,Business Analyst,"excel, power bi, communication",Not disclosed,3,False
