title,company,location,salary_min,salary_max,description,created,search_title,skills_found,salary_range,skill_count,has_salary
Esg Data Analyst,Outsized,"Mumbai, Maharashtra",,,"Project Overview Our client, a leading global snacks company, is seeking an ESG Data & Sourcing Analyst to support its regional Responsible Sourcing and Sustainability initiatives on a 2-month contract . This high-visibility role involves managing supplier engagement and analyzing data related to responsible sourcing and sustainability to ensure compliance with global and regional goals across AMEA. Reporting to the Director of Responsible Sourcing for AMEA , this role works closely with procur…",2026-05-13T18:58:57Z,Data Analyst,,Not disclosed,0,False
Lead Data Analyst,JSW Sports Pvt Ltd,"Bellary, Karnataka",,,"Inspire Institute of Sport, Bellary is looking for a Head of Data Analysis to join their team in Bellary. Role Purpose: The Head of Data Analysis will play a key role in supporting the maintenance and delivery of our TeamWorks Athlete Management System and ensuring effective data driven processes within all sports science and performance operations departments. The successful candidate will help embed a data-driven culture, providing actionable insights to coaches, operational teams and sports …",2026-04-22T17:38:15Z,Data Analyst,,Not disclosed,0,False
Salesforce Data Analyst (Data Quality),Cognex Corporation,"Noida, Ghaziabad",,,"The Role: We are seeking a Salesforce Data Quality Specialist to support the accuracy, consistency, and completeness of core data across our Salesforce and BI environment. This role is responsible for maintaining clean, reliable records across key Salesforce objects, enforcing data standards, resolving data issues, and ensuring that Salesforce data remains a trusted source of truth for commercial operations. The successful candidate will play a key role in supporting Sales, Marketing, Customer …",2026-04-28T18:46:30Z,Data Analyst,,Not disclosed,0,False
Cdp – Tech Data Analyst,Americana Restaurants,India,,,"Technical Data Analyst (CDP) Location: Mohali (Work from Office) We are looking for a Technical Data Analyst with strong experience in customer data, analytics, and CDP platforms. Key Responsibilities: Monitor data quality (completeness, accuracy, integrity) Analyze customer data to generate insights and improve data strategies Work with data from web, mobile, real-time, and GTM sources Build and automate reports using SQL / Presto Perform root cause analysis (RCA) for data issues Identify imp…",2026-04-22T17:41:58Z,Data Analyst,sql,Not disclosed,1,False
Data Analyst - Python Automation,EliteRecruitments,India,,,"Hiring Data Analyst who have strong experience in data automation using Python and its libraries numpy and pandas. Organisation - Big4 Firm Location - Bangalore/Gurgaon/Hyderabad Role Overview We are seeking a Analyst with strong experience in Python‑based automation, EUC remediation, and finance data operations. The role focuses on reducing manual, spreadsheet‑driven finance processes by building scalable, governed automation solutions using Python, Alteryx, SQL, and BI tools, with increasing …",2026-05-13T21:05:54Z,Data Analyst,"python, sql, pandas, numpy",Not disclosed,4,False
Portfolio Data Analyst (Coimbatore),Arcana,India,,,"We are seeking dynamic Portfolio Data Analysts to join our team and collaborate closely with our founders, financial analysts, product managers, and engineers. In this role, you'll play a pivotal part in supporting our client onboarding and success team. You'll need a strong ability to analyze financial data, translate insights into actionable strategies, and effectively guide clients through our platform's features to drive their success. This is a hybrid role based out of Arcana’s Coimbatore …",2026-03-14T03:06:55Z,Data Analyst,,Not disclosed,0,False
Fund Accounting- Data Analyst,Photon,"Hyderabad, Telangana",,,"Description for Internal Candidates Experience in Fund Accounting , asset servicing, or investment operations. Familiarity with NAV calculation, positions, transactions, and accounting hierarchies. Experience working with: Third‑party accounting platforms Vendor‑provided data feeds Canonical or enterprise data models Project Description: The Fund Accounting Data Project ingests, rationalizes, and publishes fund accounting data from first‑party and third‑party Fund Accounting systems into a cent…",2026-05-08T08:23:09Z,Data Analyst,,Not disclosed,0,False
Data Analyst (Laad Or Apld),PRI Global,India,,,"The ideal candidate will use their passion for big data and analytics to provide insights to the business covering a range of topics. They will be responsible for conducting both recurring and ad hoc analysis for business users. Responsibilities Understand the day-to-day issues that our business faces, which can be better understood with data Compile and analyze data related to business' issues Develop clear visualizations to convey complicated data in a straightforward fashion Qualifications B…",2026-04-30T14:55:08Z,Data Analyst,,Not disclosed,0,False
Business Analyst – Business Finance,Zepto,"Bangalore, Karnataka",,,"Designation: Business Analyst I/ II – Business Finance Qualification : Graduation – Bachelors in technology from Any Tier I College Core Areas : Analytics, Automation and Problem Solving, SQL, Advanced Excel, Dashboarding, Reporting Our Story Founded in 2021 by Aadit Palicha and Kaivalya Vohra, Zepto is on a mission to save you time —making every second count towards life's real joys. Our platform has revolutionised rapid commerce in India with cutting-edge technology and strategically optimise…",2026-05-07T16:25:44Z,Business Analyst,"sql, excel, problem solving",Not disclosed,3,False
Crm Business Analyst,Systems Plus,India,,,"SystemsPlus is hiring for CRM Business Analyst, Exp :: 3yr Location Pune Work timing : 2 to 11 pm Mandate skill set :: CRM D365, Business Analysis. What you will be doing: Collaborate with business stakeholders to fully understand, define and document business requirements for software and/or process changes through a variety of means focusing on medium to high complexity projects, processes and functional areas of the applications, including CRM applications. Conduct user interviews, surveys, …",2026-04-25T07:54:50Z,Business Analyst,,Not disclosed,0,False
Siebel Crm Business Analyst,Tata Consultancy Services,"Hyderabad, Telangana",,,"Greetings from TCS TCS is hiring for Siebel CRM Business Analyst Exp: 6 tp 12 years Location: Hyderabad, Mumbai, Bengakuru Strong Siebel CRM Functional Knowledge 2. Strong Telecom processes 3. Good in mapping the business requirements to Siebel CRM out of the box vanilla processes 4. Good in communication and able to manage the business team 5. Good in providing the workaround solutions for the critical requirements where vanilla process are NOT fit 6. Strong in creating business requirements d…",2026-04-19T17:22:37Z,Business Analyst,communication,Not disclosed,1,False
D365 Crm Business Analyst,LTM,"Bangalore, Karnataka",,,Role - Business Analyst Experience -8-14 Years relevant Location- PAN India LTIM locations Job Description • Experience must include creating requirement specifications based on Architecture/Design/Detailing of Processes In-depth functional knowledge of Microsoft Dynamics D365 CRM Power platform • Microsoft D365 implementation and Azure integration experience • Possess both functional and technical expertise • Business analysis and process engineering skills a plus • Experience reviewing busine…,2026-05-10T08:50:22Z,Business Analyst,azure,Not disclosed,1,False
Business Analyst - Crm Sales,MSC TECHNOLOGY INDIA,"Chennai, Tamil Nadu",,,"Role: Business Analyst / Consultant / Techno-Functional Consultant in CRM Domain Tools & Technologies: Microsoft Dynamics 365 Sales Power Platform: Power Automate, Power BI, Power Apps Administrator Level Access on Dataverse Skills & Knowledge: CRM Expertise: Experience with CRM software (e.g., Salesforce, Microsoft Dynamics) Understanding of basic CRM Sales modules, best practices, and functionality Dynamics 365, PowerApps & Power Platform: In-depth knowledge of Dynamics 365 Sales Proficiency …",2026-05-07T16:21:38Z,Business Analyst,power bi,Not disclosed,1,False
Oracle Siebel Crm Business Analyst,Tata Consultancy Services,"Bangalore, Karnataka",,,"Role - Oracle Siebel CRM Business Analyst Location - Bangalore ,Hyderabad , Mumbai Experience - 7 to 12 years Job Requirements 1. Strong Siebel CRM Functional Knowledge 2. Strong Telecom processes 3. Good in mapping the business requirements to Siebel CRM out of the box vanilla processes 4. Good in communication and able to manage the business team 5. Good in providing the workaround solutions for the critical requirements where vanilla process are NOT fit 6. Strong in creating business require…",2026-03-29T09:55:47Z,Business Analyst,communication,Not disclosed,1,False
Coupa Configuration Specialist/Business Analyst,MSR Technology Group,"Delhi, India",,,"Title: Coupa Configuration Specialist/Business Analyst Location: 12 Months Duration: Configuration of Coupa CLM features including templates, clauses, workflows, and metadata Configuration of intake forms, approval workflows, and procurement request processes Support of supplier‑facing and transactional workflows (POs, invoices, supplier documents) Development and enhancement of Coupa reports and dashboards Execution of data cleanup, validation, custom fields, and metadata structures Support fo…",2026-04-30T14:55:07Z,Business Analyst,,Not disclosed,0,False
Technical Business Analyst - Data Modeling,Luxoft,India,,,"Project Description: We are looking for an experienced specialist to work for one of our clients from the banking industry. Responsibilities: In this role, you will closely work with the development team. You will be the person who will be able to describe what needs to be done and how in technical way, who define, prioritize and manage the team's sprint backlog, which is managed within a large-scale agile organization based on SAFe. You will be the first point of contact between the Product ow…",2026-05-01T16:58:52Z,Business Analyst,,Not disclosed,0,False
Business Analyst - Finance (Fresher- Chartered Accountant),Ramco Systems,"Chennai, Tamil Nadu",,,"Job Title: Business Analyst - Finance (Fresher- Chartered Accountant) Job Summary: Ramco Systems is looking for a proactive and analytical fresher Chartered Accountant to join our team as a Business Analyst. This role involves working closely with cross-functional teams, supporting ERP implementation projects, and delivering customized solutions to meet client needs. The ideal candidate should have a strong passion for finance and technology, exceptional analytical abilities, and the adaptabili…",2026-04-23T17:43:52Z,Business Analyst,,Not disclosed,0,False
Subject Matter Expert / Business Analyst - Commercial Lending,Intellect Design Arena Ltd,"Mumbai, Maharashtra",,,"SME/BA - Commercial Lending - 6 to 12 Years - Mumbai/Chennai We are looking for a detail-oriented and strategic Commercial/SME-MSME Lending, Subject Matter Expert/Business Analyst to join our team. The successful candidate will play a vital role in analysing business processes, identifying opportunities for improvement, and supporting the development and implementation of Commercial/SME-MSME lending solutions. This position requires strong analytical skills, industry knowledge, and the ability …",2026-05-10T08:52:32Z,Business Analyst,,Not disclosed,0,False
Senior Business Analyst - Oracle Financials [T500-25251],Ferguson GCC,"Bangalore, Karnataka",,,"About Ferguson: Since 1953, Ferguson has been a source of quality supplies for a variety of industries. Together We Build Better infrastructure, better homes and better businesses. We exist to make our customers’ complex projects simple, successful, and sustainable. We proactively solve problems, adapt and grow to continuously serve our customers, communities and each other. Ferguson is proud to provide best-in-class products, service and capabilities across the following industries: Commercial…",2026-04-16T15:06:12Z,Business Analyst,,Not disclosed,0,False
Business Intelligence Analyst,Newfold Digital,"Mumbai, Maharashtra",,,"Who We Are At Network Solutions, we’ve been trusted for decades to help people get online and stay ahead. We’ve been here since the beginning of the internet, and we’re still building for what comes next. As the original digital identity authority, we help secure domain names, protect brands, and safeguard the infrastructure businesses rely on. We empower our customers to own and manage the assets that define them online, while delivering enterprise-grade security to protect against virtual thr…",2026-04-30T14:52:25Z,Business Analyst,,Not disclosed,0,False
Sr. Finance Business System Analyst,Insight Global,India,,,"Position Summary The Senior Finance Business System Analyst is responsible for providing continuity, stability, and incremental improvement of our Finance systems. This role serves as the primary technology partner for Finance, Accounting, FP&A, and related stakeholders, ensuring effective day to day support, trusted stakeholder engagement, and reliable execution of Finance system requests. This role will operate within an established Finance systems environment, with Sage Intacct as the primar…",2026-04-18T17:10:33Z,Business Analyst,,Not disclosed,0,False
Workday Business/System Analyst (Finscm Integrations),Luxoft,"Hyderabad, Telangana",,,"Project description This role focuses on Workday Business and Systems Analysis Responsibilities Work on Operational items like Incidents, requests, upgrades etc., Work on Enhancements, Projects etc., Support On-Call Work experience on Workday Supply Chain Modules (functional) Work experience on FINSCM Integrations (EIB and STUDIO) Work experience on creating Studio integrations is a must Knowledge on Supply Chain and Finance ancillary applications like GHX Marketplace, Axiom, Strata, Banking ap…",2026-05-09T18:31:15Z,Business Analyst,,Not disclosed,0,False
Informatica Developer,CosMicIT ???????? ???????? ???????? ????????,India,,,"About the Company Informatica IDMC Developer: India, JD below: About the Role Strong SQL skills with experience in SQL Server and/or Oracle databases. Responsibilities 5y experience in Informatica IDMC (CAI and CDI) on both MDMH and regular non-MDMH interfaces 3y experience in Power Center Experience with connector configuration and integration patterns Familiarity with certificate management and renewal processes Excellent English levels Sense of ownership, attitude, proactivity to engage in d…",2026-05-08T16:34:06Z,Business Analyst,"sql, excel",Not disclosed,2,False
Sap Brim Consultant,Eurotechsol,"Noida, Ghaziabad",,,"JD - Collect and review the detailed business specifications with internal customers and the Product Owners/Solution Definition Managers. • Based on high level business requirements, design and propose to Product Owners, Solution Definition Managers and Solution Architects solutions and alternative ways to manage the requirements based on the standard capabilities of BRIM platform, mainly CC module. • Analyze the detailed impacts on existing processes end-to-end, from User Experience, Mediation…",2026-04-21T07:42:27Z,Business Analyst,,Not disclosed,0,False
Senior Quality Assurance Automation Engineer,ACL Digital,"Bangalore, Karnataka",,,"Only immediate joiners (6-9 Years) BE/ B. Tech/ ME/M Tech/ MCA / MSc Automation Testing - Mandatory Python Automation - Mandatory Robot Framework - Mandatory API Testing – Mandatory Design, develop, and maintain automated test scripts using Python Build automation frameworks using Robot Framework and/or Selenium Execute automated test suites and analyze test results Collaborate with developers, product owners, and business analysts to understand requirements Perform API testing , and basic data…",2026-04-29T00:39:23Z,Business Analyst,python,Not disclosed,1,False
Functional Analyst,Tata Consultancy Services,"Mumbai, Maharashtra",,,"Greetings from TCS TCS Mumbai hiring for Business Functional Analyst Role: Business Functional Analyst Experience required: 2 to 4 years Location:- Mumbai Must Have Skills:- 2 to 6 Years of experience using ERP Ability to Understanding client's business processes and mapping them with ERP functionality Documenting client requirements and coordinating with different internal groups for resolution and Root Cause Analysis. Roles and Responsibilities:- Handling client queries, tickets and change r…",2026-04-16T15:12:10Z,Business Analyst,,Not disclosed,0,False
Subject Matter Expert - Lending,Intellect Design Arena Ltd,"Mumbai, Maharashtra",,,"Company: Intellect Design Arena Limited SME/BA – Lending Location: Chennai/Mumbai Overview 1. Bring a good understanding of the Lending domain having worked in similar capacity earlier 2. Shall be able to guide, handhold and groom the team of Business Analyst throughout the project 3. Interact with business users and technical team for understanding of functional requirements 4. Document business requirements and process flows using different tools like JIRA, Confluence, BlueWorks, Lucid Chart,…",2026-05-07T20:23:10Z,Business Analyst,,Not disclosed,0,False
Etl Testing,LTM,"Coimbatore, Tamil Nadu",,,Define and implement test data strategies for ETL Apps Lead testing of ETL pipelines of data marts and data warehouses Design develop and optimize tests to validate ETL workflows Write and review complex SQL queries for data validation with respect to given business rules transformation logics Collaborate with business analysts QA and development teams to understand data requirements and ensure coverage Automate test data generation and provisioning processes Primary Skills Strong experience in…,2026-05-08T08:24:41Z,Business Analyst,sql,Not disclosed,1,False
Mis Executive,Anand Rathi Share and Stock Brokers Ltd,"Mumbai, Maharashtra",,,Anand Rathi Shares and Stockbrokers is Hiring for MIS Executive. Job Description: - • Possess a strong understanding of the current regulatory environment and financial / securities market rules and regulations • One point of contact at HO Level for Operations & Business MIS Support for different Business • Handling teams and help them to prepare MIS and Submit to respective Business • Creating required MIS to the management for the business understanding • Scheduling and creating a review fram…,2026-04-26T00:01:23Z,Business Analyst,,Not disclosed,0,False
Senior Vice President - Casa Backoffice Operations,Peoplefy,"Chennai, Tamil Nadu",,,"Targeting candidates with 20 years of total experience , with 10–15 years specifically in CASA back-office operations . Strong preference for candidates from a Corporate Banking background ; pure retail banking profiles will not be considered . Candidates should have hands-on experience in end-to-end CASA operations including account opening and maintenance, transaction processing (deposits, withdrawals, etc.), interest calculation, etc. Experience in OD management, Time Deposit, Foreign Exchan…",2026-04-19T17:25:33Z,Business Analyst,,Not disclosed,0,False
Functional Product Analyst (Aa) - India,Thakral One,India,,,"As a Functional Product Analyst (AA) , you will support analysis, configuration, and delivery activities across AA Retail, AA Deposits, and AA Loans in the Temenos T24 core banking system. You will interpret business requirements, work directly with users, and contribute to implementation projects through strong functional expertise. What You’ll Do and How You’ll Succeed Job Requirements Apply more than ten years of experience as a Business Analyst in the Temenos T24 core banking system. Use st…",2026-03-19T10:20:40Z,Business Analyst,,Not disclosed,0,False
Finance Analyst - Supply Chain,Talent Destination,"Mumbai, Maharashtra",,,"This position will lead the Business Analyst activity for the Operations and Supply Chain team. This is a growth-oriented business that is part of a global group engaged in import, warehousing, distribution, and some tire-to-wheel assembly. This role will support the Operations team by providing analysis and assessment of operational and financial results to support decision-making and continuous improvement. This role is highly visible and essential to the team's effectiveness, supporting them…",2026-05-09T18:31:59Z,Business Analyst,,Not disclosed,0,False
Guidewire Cc Configuration Developer- Immediate Joiners,Stratus,India,,,"Job Description: We are looking for a skilled Guidewire ClaimCenter Configuration Developer to join our team. The ideal candidate will have strong experience in configuring ClaimCenter and delivering high-quality solutions within the Guidewire platform. Key Responsibilities: Configure and customize Guidewire ClaimCenter based on business requirements Develop and maintain business rules, workflows, and UI components Collaborate with business analysts and stakeholders to understand functional nee…",2026-04-23T17:43:54Z,Business Analyst,,Not disclosed,0,False
System Tester,Infocareer,"Chennai, Tamil Nadu",,,"Location : Chennai Years of Experience : 4 Years Notice Period : Immediate Roles & Responsibilities: Analyze business requirements and prepare test scenarios, test cases, and test data. Perform Functional, Regression, Integration, and System Testing. Validate Non-Life Insurance modules such as Policy Administration, Claims, Underwriting, Renewals, and Billing. Identify, track, and report defects using defect tracking tools. Coordinate with developers, business analysts, and stakeholders for iss…",2026-05-12T18:51:22Z,Business Analyst,,Not disclosed,0,False
Forensic Analyst,Innefu Labs,"Delhi, India",,,"Company Description ( www.innefu.com ) We are a Series A Funded New Age Information Security & Data Analytics Company and we take pride in the fact that we have been delivering value to our customers with our innovative offerings and helping them adopt a variety of our security solutions that are based on cutting edge technologies like Artificial Intelligence, Predictive Intelligence, Facial Biometrics and so on. We are among the top 5 Cyber excellence companies globally (Holger Schulze awards)…",2026-05-02T07:06:18Z,Business Analyst,excel,Not disclosed,1,False
Sap Business Strategy (Workzone Architect),Tata Consultancy Services,"Hyderabad, Telangana",,,"Greetings from TCS TCS is Hiring for SAP Business Strategy (Workzone architect) Exp: 6 to 12 years Location: Hyderabad, Chennai, Ahmedabad Candidate should have experience in designing and implementing solutions using at least two components below which is part of SAP Workzone • SAP Cloud Portal serviceM • SAP Workflow Management • SAP One Inbox • SAP Mobile Services • SAP Conversational AI Create comprehensive documentation for solutions, BTP integrations, and best practices. Conduct knowledge…",2026-05-10T08:52:15Z,Business Analyst,,Not disclosed,0,False
Egrc Bwise,Birlasoft,"Noida, Ghaziabad",,,"Job Description & Responsibilities Solution Design & Configuration Analyse business requirements and translate them into robust configurations or customizations within the eGRC platform (e.g., SAI360 BWise). Develop forms, dashboards, workflows and automation scripts as needed. Technical Expertise & Delivery Develop GRC Solutions with minimal supervision. Prepare and maintain solution documentation, configuration logs, and user guides. Maintain a high standard of quality and adhere to establish…",2026-05-06T16:19:34Z,Business Analyst,,Not disclosed,0,False
T24,Lorven Technologies Inc.,"Chennai, Tamil Nadu",,,"Job Title: T24 Securities Module Specialist Experience: 10 Years Location: Chennai Job Summary: We are seeking an experienced T24 professional with deep expertise in the Securities module. The ideal candidate will have over 10 years of hands-on experience in Temenos T24, along with strong exposure to TAP (Temenos Application Platform) and TPH (Temenos Payment Hub). This role requires a strong understanding of banking operations, system configuration, and integration within the T24 ecosystem. Ke…",2026-05-02T11:05:15Z,Business Analyst,,Not disclosed,0,False
Data Engineer,HCLTech,"New Delhi, Delhi",,,"Role: Snowflake, Veeva MDM Experience: 6 years Location: Pan India Mandatory Skills: Snowflake, Veeva MDM, SQL, Python, Pharma Domain Experience Job Description: Snowflake profiles with a good understanding of MDM fundamentals Required Skills & Experience Core Skills Strong understanding of MDM fundamentals (golden record, matching, survivorship, hierarchies, data quality). Experience working with Commercial Pharma data , including HCP, HCO, affiliations, and related reference data. Hands‑on ex…",2026-04-18T17:08:58Z,Business Analyst,"python, sql",Not disclosed,2,False
Artificial Intelligence Engineer,Greystar,"Bangalore, Karnataka",,,"Job Summary : At Greystar-India, the AI Center of Excellence (COE) is reimagining how Finance & Accounting operates across our global enterprise — spanning property accounting, investment accounting, accounts payables, accounts receivables, contracts and audits, budgeting, procure-to-pay, order-to-cash, and financial planning and analysis. Not every solution we build will need an AI component — but where it does, the AI Developer is the craftsperson who brings it to life. As an AI Developer, yo…",2026-05-07T16:25:03Z,Business Analyst,excel,Not disclosed,1,False
