title,company,location,salary_min,salary_max,description,created,search_title,skills_found,salary_range,skill_count,has_salary
Data Analyst,Vrinda International,"Coimbatore, Tamil Nadu",1300000,1700000,"We’re Hiring: Data Analyst Location: Coimbatore (Work From Office) Experience: 4–6 Years Budget: Up to ₹20 LPA (Non-negotiable) Notice Period: Immediate joiners preferred (Max: 1st week of June) Interview Process: 2 Rounds (1 Virtual 1 Face-to-Face) Job Summary We are looking for skilled Data Analysts with strong expertise in data visualization, automation, and analytics tools. The ideal candidate should be capable of handling data-driven insights and business reporting efficiently. Requiremen…",2026-05-05T20:08:32Z,Data Analyst,data visualization,"1,300,000 - 1,700,000",1,True
Data Analyst,AcquireX,"Pune, Maharashtra",,,"Job Title- Data Analyst Experience- 6 plus years. Location- Viman Nagar Pune. Timings- 11 am- 8 pm. Be part of AcquireX team that unleashes the power of leading-edge technologies to help improve e-commerce processes in the e-commerce world. We are looking for a Data Analyst to analyze, transform, and validate data that powers analytics, reporting, and operational decision-making. You will work with multiple data sources and internal systems to ensure data accuracy, consistency, and usability. K…",2026-05-06T10:46:14Z,Data Analyst,,Not disclosed,0,False
Data Analyst,,"Thiruvananthapuram, Kerala",,,Immediate requirement for the post of Data Analyst on rotation Shift (Male or Female). Persons only willing to work in both shifts need to apply.careers.coretechgmail.comorplease contact 9.4.nine.6.8.1.5.6.3.0,2024-05-10T07:38:46Z,Data Analyst,,Not disclosed,0,False
Data Analyst,Kivi-Tronics Consulting,"Khadki, Pune",,,"Job Description – Data Analyst (MDM Implementation) Experience: 6 Years Location: Pune (Hybrid) Job Summary We are seeking an experienced Data Analyst with strong expertise in Master Data Management (MDM), data analysis, data governance, and data quality initiatives. The ideal candidate should have hands-on experience in analyzing large datasets, identifying data inconsistencies, supporting MDM implementation projects, and collaborating with cross-functional teams to establish accurate and stan…",2026-05-23T08:18:02Z,Data Analyst,,Not disclosed,0,False
Data Analyst,SkySun,India,,,"Role Overview We are looking for a Data Analyst with strong expertise in Microsoft Excel who can efficiently work with large datasets, formulas, and analytical models. The ideal candidate should be able to transform raw data into meaningful insights , build efficient spreadsheets, and support business decisions through structured analysis and reporting. This role requires someone who is highly detail-oriented, analytical, and extremely efficient in Excel-based data handling. Key Responsibilitie…",2026-03-27T13:39:38Z,Data Analyst,excel,Not disclosed,1,False
Data Analyst,Aqilea ,"Bangalore, Karnataka",,,"Company Description Aqilea is an IT and engineering consulting partner that helps companies get more out of their technology and operations. With teams in Stockholm and Bangalore, we work closely with our clients to build solutions that fit their needs - from software development, AI and infrastructure engineering to industrial automation and embedded systems. We combine strong technical expertise with a practical, business-focused approach to help organizations modernize, improve security, and…",2026-04-24T10:40:42Z,Data Analyst,,Not disclosed,0,False
Data Analyst,Evnek Technologies Pvt Ltd,"Immedihalli, Bangalore",,,"Role: Data Analyst Experience: 5 Years Location: Remote (India) Notice Period: Immediate Joiners Only Role Overview We are seeking an experienced Data Analyst with strong expertise in SQL, product analytics, and BigQuery to support the development of realistic AI benchmarking environments. The ideal candidate should possess deep knowledge of product event data systems, dimensional modeling, and data quality troubleshooting in large-scale analytics ecosystems. In this role, you will help design …",2026-05-12T02:19:56Z,Data Analyst,sql,Not disclosed,1,False
Data Analyst,Weekday AI,India,,,"This role is for one of the Weekday's clients Salary range: Rs 1000000 - Rs 1500000 (ie INR 10-15 LPA) Min Experience: 1 years Location: Bengaluru JobType: full-time We are looking for a detail-oriented and analytical Data Analyst to join a fast-growing, data-driven team based in Bengaluru. This full-time role is ideal for professionals with 1–2 years of experience who are passionate about working with data to uncover insights and drive strategic decisions. You will play a key role in transform…",2026-04-15T19:29:56Z,Data Analyst,,Not disclosed,0,False
Data Analyst,LRN Corporation,India,,,"Position: Data Analyst Location: Mumbai, India About LRN: LRN is the world’s leading dedicated ethics and compliance SaaS company, helping more than 30 million people every year navigate complex regional and global regulatory environments and build ethical, responsible cultures. With over 3,000 clients across the US, EMEA, APAC, and Latin America—including some of the world’s most respected and successful brands—we’re proud to be the long-term partner trusted to reduce organizational risk and d…",2026-04-09T01:03:12Z,Data Analyst,,Not disclosed,0,False
Data Analyst,Laundryheap,India,,,"Laundryheap is an award-winning, industry-leading startup transforming the laundry and dry cleaning industry. With services across 14 global markets and expanding rapidly across Europe, Asia, and North America, we pride ourselves on delivering clean clothes within 24 hours, making us one of the fastest services in the business. The Role As a Data Analyst, you will play a critical role in driving business performance by transforming data into clear, actionable insights. This role goes beyond rep…",2026-04-22T23:19:38Z,Data Analyst,,Not disclosed,0,False
Data Analyst,Acme Services Private Limited,"Yerwada, Pune",2000000,2100000,"Job Description: Develop, maintain, and validate data mapping documentation to support business and technical requirements. Define, implement, and monitor data quality rules to improve data accuracy, consistency, and reliability. Support strategic initiatives by analyzing data, identifying issues, and recommending practical solutions. Partner with business and technical stakeholders to gather requirements, clarify objectives, and align data efforts with organizational priorities. Perform comple…",2026-05-22T22:29:08Z,Data Analyst,,"2,000,000 - 2,100,000",0,True
Data Analyst,Renesas Electronics,"Bangalore, Karnataka",,,"Job Description Job Purpose & Dimensions Ensure global master data is being maintained on a highest quality level throughout their lifecycle. Define and continuously improve and implement measures, processes and tools to control global master data consistency and enhance existing tools. Core Responsibilities Maintain and govern master data across SCM systems, ensuring data quality, consistency, and compliance with governance standards. Ensure adherence to Master Data Governance (MDG) standards,…",2026-05-27T09:50:51Z,Data Analyst,,Not disclosed,0,False
Data Analyst / Senior Data Analyst,Hdfc Life,"Chennai, Tamil Nadu",,,"Job Purpose The Data Analyst Senior Data Analyst will play a key executive role in delivering strategic business initiatives across the bank. This position will be responsible for aligning business needs with technology solutions, ensuring business strategies are effectively implemented, and enhancing operational efficiency. The ideal candidate will be able to leverage deep industry knowledge, data analysis expertise Skills & Competencies: Strong understanding of banking operations, products, a…",2026-04-11T07:04:50Z,Data Analyst,,Not disclosed,0,False
Data Analyst,Cornerstone onDemand,"Pune, Maharashtra",,,"Data Analyst - Enterprise Data Management Location: Hyderabad, India About the Role: We are seeking an experienced Data Analyst to join our Enterprise Data Management team, with a core focus on Data Quality, Data Governance, and Master Data Management (MDM). In this role, you will be responsible for analyzing, profiling, and enhancing data within critical enterprise applications, including Salesforce, Oracle ERP, and Marketo. A key part of your responsibilities involves establishing and maintai…",2026-02-20T13:15:56Z,Data Analyst,,Not disclosed,0,False
Data Analyst,Digital Twin,"Pune, Maharashtra",,,"Job Summary - Data Analyst We are looking to hire a data analyst to join our enterprise customer solutions team. As a Data Analyst, one will take responsibility for developing reports, and troubleshooting data issues. To do well in this role you need attention to detail, past experience as a data analyst, and a deep understanding of the popular data analysis tools and databases. Data Analyst Responsibilities: ● Commissioning and decommissioning of data sets. ● Processing confidential data and i…",2026-05-21T02:12:34Z,Data Analyst,,Not disclosed,0,False
Data Analyst,SveltetechTechnologies Pvt Ltd,"Delhi, India",,300000,"Data Analyst Job Duties Data analyst responsibilities include conducting full lifecycle analysis to include requirements, activities and design. Data analysts will develop analysis and reporting capabilities. They will also monitor performance and quality control plans to identify improvements. Responsibilities Interpret data, analyze results using statistical techniques and provide ongoing reports Develop and implement databases, data collection systems, data analytics and other strategies tha…",2021-02-15T04:27:43Z,Data Analyst,,Not disclosed,0,False
Data Analyst,Qrata,"Delhi, India",1000000,1200000,"Job Title: Data Analyst Job Brief: The successful candidate will turn data into information, information into insight and insight into business decisions. Data Analyst Job Duties Data analyst responsibilities include conducting full lifecycle analysis to include requirements, activities and design. Data analysts will develop analysis and reporting capabilities. They will also monitor performance and quality control plans to identify improvements. About Us We began in 2015 with an entrepreneuria…",2024-01-07T15:08:07Z,Data Analyst,,"1,000,000 - 1,200,000",0,True
Data Analyst,Amicus Therapeutics,"Bangalore, Karnataka",,,"Position Description Data Analyst Location: Remote/Bangalore Amicus Therapeutics is a global, patient-dedicated biotechnology company focused on discovering, developing and delivering high-quality medicines for people living with rare metabolic diseases. Position Summary Data analyst responsibilities include conducting full lifecycle analysis to include requirements, activities and design. Data analysts will develop analysis and reporting capabilities. They will also monitor performance and qua…",2025-04-16T01:41:37Z,Data Analyst,,Not disclosed,0,False
Data Analyst,Amicus India,"Bangalore, Karnataka",,,"Data Analyst Location: Remote/Bangalore Amicus Therapeutics is a global, patient-dedicated biotechnology company focused on discovering, developing, and delivering high-quality medicines for people living with rare metabolic diseases. Position Summary Data analyst responsibilities include conducting full lifecycle analysis to include requirements, activities and design. Data analysts will develop analysis and reporting capabilities. They will also monitor performance and quality control plans t…",2026-05-30T02:27:15Z,Data Analyst,,Not disclosed,0,False
Data Analyst,Boolean Staffing Recruitment Solutions Pvt Ltd,"Bangalore, Karnataka",2300000,2500000,"Job Description : We are looking primarily for Data analysts who have experience in analysing the data and have good knowledge on SQL, Python, Tableau and have knowledge/ some exp in ETL. Job Title: Sr. Data Analyst Experience – 5 to 8 Years Location – Bangalore Roles & Responsibilities : We are looking for data analysts who will elicit requirements and translate them into data and analysis requirements. Further they will create data driven insights and dashboards that enable a variety of stake…",2025-12-24T06:24:48Z,Data Analyst,"python, sql, tableau","2,300,000 - 2,500,000",3,True
Data Analyst,Leading Client,"Hyderabad, Telangana",,,"Job Description Role Overview: We are looking for an experienced Data Business Analyst with strong exposure to Snowflake and Databricks who can work closely with business stakeholders and analytics teams.Job Title: Data Business Analyst Key Skills & Experience: 5 years of experience as a Business Analyst / Data Business Analyst Strong hands-on experience with Snowflake and Databricks Advanced SQL skills for data analysis and validation Experience with data pipelines, ETL processes , and data qu…",2026-05-12T05:45:42Z,Data Analyst,sql,Not disclosed,1,False
Data Analyst,InTouch CX,"Hyderabad, Telangana",,,"About the Job We are looking for a Data Analyst who is a self-starter with the ability to work in a fast-paced, performance driven environment. The incumbent will be responsible for the analysis and reporting of operational related data in an on-going effort to increase visibility for program performance. As Data Analyst, You Will… Collect, analyze, evaluate and report data in order to increase visibility into performance for all lines of business within 24-7 Intouch Complete projects and ad-ho…",2026-01-16T00:31:50Z,Data Analyst,,Not disclosed,0,False
Data Analyst,Careernet,India,,,"Job Description Key Skills: Data Analyst, Data Analysis, Python, Product Owner, SQL Roles and Responsibilities: Analyze and interpret complex datasets related to marketing performance and customer engagement. Collaborate with Product Owners to understand business objectives and translate them into data-driven insights. Use Python and ANSI-SQL for data extraction, manipulation, and advanced analysis. Merge data from multiple source systems while ensuring data accuracy and consistency. Clean, tra…",2026-04-05T03:36:04Z,Data Analyst,"python, sql",Not disclosed,2,False
Data Analyst,RECEX,"Kolkata, West Bengal",,,"Job Description: Job Title: Data Analyst Job Description: We are looking for a skilled Data Analyst to collect, analyze, and interpret large datasets to help drive business decisions. The ideal candidate will have strong analytical skills, attention to detail, and experience with data visualization tools. Key Responsibilities: Analyze data to identify trends and insights. Create dashboards and reports for internal stakeholders. Collaborate with teams to understand data needs. Ensure data accura…",2026-05-14T02:27:02Z,Data Analyst,data visualization,Not disclosed,1,False
Data Analyst,Fatakpay,India,800000,1500000,"Job Title : Data Analyst-Fintech Job Description : We are seeking a highly motivated and detail-oriented Data Analyst with 2 to 4 years of work experience to join our team. The ideal candidate will have a strong analytical mindset, excellent problem-solving skills, and a passion for transforming data into actionable insights. In this role, you will play a pivotal role in gathering, analyzing, and interpreting data to support informed decision-making and drive business growth. Key Responsibiliti…",2024-12-07T13:03:54Z,Data Analyst,excel,"800,000 - 1,500,000",1,True
Data Analyst,Sutherland Global Services Private Limited,"Chennai, Tamil Nadu",,,"Data Analyst Chennai (Temporary WFH) Time: 12.30pm to 9.30pm Company Description As a data analyst you will be responsible for collecting, analyzing, and interpreting data to help drive informed business decisions. You will work closely with cross-functional teams to identify trends, generate insights, and provide actionable recommendations based on data-driven findings. Job Description Responsibilities: Collaborate with cross-functional teams and identify opportunities for automation Create an…",2026-04-28T06:42:53Z,Data Analyst,,Not disclosed,0,False
Data Analyst,Malaysian Global Innovation and Creativity Centre,India,500000,1000000,"MaGIC Technology and Product team is looking for a data analyst to help expand and improve data on startups, investors, and founders in the ASEAN region. As part of the data team on our Startup Database product, you will assist in maintaining the accuracy of information on startups and investors, and continuously update our repository with latest publicly available data on the same. The job offers a high degree of autonomy and will also see you playing a leading role in the analysis of the data…",2019-06-05T21:12:29Z,Data Analyst,,"500,000 - 1,000,000",0,True
Data Analyst,Navrang HR Solutions,"Surat, Gujarat",,,"Job Description: Key Responsibilities  Assist in extracting, cleaning, and analyzing datasets using SQL and Python.  Develop and maintain dashboards and reports using Power BI, Looker Studio, or other BI tools.  Support the team in data validation, quality checks, and troubleshooting.  Collaborate with senior data analysts and business teams to understand requirements and deliver insights.  Perform exploratory data analysis (EDA) to identify trends, patterns, and anomalies.  Automate recu…",2026-05-13T01:59:29Z,Data Analyst,"python, sql, power bi",Not disclosed,3,False
Data Analyst,In Touch,"Hyderabad, Telangana",,,"About the Job Join us in transforming the perception of customer service! We are seeking a dedicated Data Analyst to analyze and report on operational data, enhancing program performance visibility. This role is vital in contributing to various projects and performing ad-hoc analyses, providing timely insights that support strategic decision-making. If you are passionate about data and eager to make a significant impact, we invite you to apply! As Data Analyst, You Will… Collect and organize la…",2026-01-16T00:45:45Z,Data Analyst,,Not disclosed,0,False
Data Analyst,NatWest Group,"Bangalore, Karnataka",,,"Job Description Join us as a Data Analyst Take on a new challenge in a cutting edge data team, in which you'll contribute to the analysis of complex bank, franchise or function data to identify business issues and opportunities We'll look to you to provide high quality analytical input to help develop and implement innovative processes and resolve problems across the bank This is a hands on role in which you'll hone your data analysis expertise and gain valuable experience in a dynamic area of …",2026-04-23T06:58:18Z,Data Analyst,,Not disclosed,0,False
Data Analyst,Harman Connected Services Corporation India Private Limited,"Bangalore, Karnataka",,,"Apply mathematical, problem-solving, and coding skills to manage big data, extracting valuable insights and making key recommendations. Design and build tailor-made solutions from this data, aiding the Area Learning Leadership (ALL) in achieving their unique objectives and goals. Work closely with ALL nominated stakeholders to understand their business problems and objectives and design data modelling processes, create algorithms and build models to address. Undertake data collection, preproces…",2026-05-02T06:48:35Z,Data Analyst,,Not disclosed,0,False
Data Analyst,NAVVYASA CONSULTING PRIVATE LIMITED,India,,,"About the Role We are looking for a highly skilled Data Analyst or Data Scientist with strong expertise in Python and SQL to join our client’s team. The primary responsibility will be to automate data-driven workflows and processes based on detailed business steps provided by the Product and Business teams. The ideal candidate will bridge the gap between analytics, process understanding, and automation execution. Key Responsibilities ● Collaborate with the Business and Product teams to understa…",2025-11-20T00:58:08Z,Data Analyst,"python, sql",Not disclosed,2,False
Data Analyst,Namaste Credit,"Bangalore, Karnataka",500000,1000000,"About the Role The following Job Specification is intended to reflect the nature, range and context of the work. It identifies the main requirements of the job but is not an exhaustive list of duties. The Data Analyst role is a vital role as to be a sole point of contact responsible for closely working with various teams internally and closely working with the CTO. This role typically requires the resource to analyse the vast number of datasets and provide a meaningful impact and the result of …",2020-09-19T01:45:32Z,Data Analyst,,"500,000 - 1,000,000",0,True
Data Analyst,The Simpsons,India,,,"Summary: We are seeking a skilled Data Analyst to join our team in India. In this role, you will analyse complex data sets to help drive business decisions. Ideal candidates will have a strong analytical mindset and experience with data visualisation tools. This is a great opportunity to contribute to impactful projects and grow your career in data analysis. Responsibilities: – Collect, process, and perform statistical analyses on large data sets. – Create data visualisations to present finding…",2026-05-14T02:29:10Z,Data Analyst,,Not disclosed,0,False
Data Analyst,Capco,"Pune, Maharashtra",,,"Job Title: Data Analyst About Us “Capco, a Wipro company, is a global technology and management consulting firm. Awarded with Consultancy of the year in the British Bank Award and has been ranked Top 100 Best Companies for Women in India 2022 by Avtar & Seramount . With our presence across 32 cities across globe, we support 100 clients across banking, financial and Energy sectors. We are recognized for our deep transformation execution and delivery. WHY JOIN CAPCO? You will work on engaging pro…",2026-05-11T02:19:14Z,Data Analyst,,Not disclosed,0,False
Data Analyst,ALIQAN Technologies,"Gurgaon, Haryana",,,"Job Title: Data Analyst Insurance Domain Experience: 9 to 12 Years Duration: 6 Months Employment Type: Contractual Work Location: Gurugram & Bangalore (Priority) | Chennai, Pune, Mumbai (Secondary) Key Responsibilities: Analyze large, complex datasets to identify trends, patterns, and insights relevant to the insurance business. Design and implement data models to support analytical and operational reporting needs. Build and maintain scalable data architectures using cloud platforms such as Azu…",2026-03-31T03:33:22Z,Data Analyst,,Not disclosed,0,False
Data Analyst,Virtusa,India,,,"Data Analyst / BI Analyst Location HYD Campus, Hyderabad Years of Experience 6-7 years Job Summary We are seeking a skilled Data Analyst / BI Analyst with 6-7 years of experience, preferably in an offshore delivery model. The ideal candidate will have a strong background in data analytics, with expertise in Power BI, SQL, and data warehousing concepts. This role involves analyzing large datasets to derive actionable insights and effectively communicating findings to stakeholders. Responsibiliti…",2026-05-27T02:22:12Z,Data Analyst,"sql, power bi",Not disclosed,2,False
Data Analyst,Reality Premedia Services Pvt Ltd,"Pune, Maharashtra",,800000,"We at Reality Premedia pvt ltd is looking for Data Analyst for Pune location. Must have experience in BFSC domain. Exp- Min 3yrs Location- Pune Mandatory Skills- Exp in powerBI/Tableau, SQL Basic Python Skills:- Tableau, PowerBI and Data Analytics",2021-09-29T05:01:45Z,Data Analyst,"python, sql, tableau",Not disclosed,3,False
Data Analyst,LT-Larsen & Toubro Limited,India,,,"Data Analyst Job Description: Roles and Responsibilities ( 2 YEARS experience) A data analyst is responsible for organizing data related to sales numbers, market research, logistics, linguistics, or other behaviours. They utilize technical expertise to ensure data is accurate and high-quality. Data is then analyzed, designed, and presented in a way that assists individuals, businesses, and organizations make better decisions. Using automated tools to extract data from primary and secondary sour…",2026-05-17T02:20:41Z,Data Analyst,,Not disclosed,0,False
Data Analyst,Intelliatx Therapeutics,"Bangalore, Karnataka",,,"Data Analyst – Job Decription Connecting people with each other and the right information is mission critical. Our Company develops innovative cloud-based technology to make it easier, more effective and more efficient to make the right connections. Our solutions put people in sync with each other and the right information, so they gain the insight needed to reach better decisions on the issues that matter most. We do it with a laser focus on reliability. The Company is a leading provider of te…",2025-11-19T22:19:09Z,Data Analyst,,Not disclosed,0,False
Data Analyst,RegisterKaro,India,400000,1000000,"Job Description: Data Analyst Position: Data Analyst Location: Gurgaon Experience Level: 1-3 Years Employment Type: Full-Time Role Overview We are looking for a results-driven Data Analyst to join our team and support business decision-making through data insights and analytics. The ideal candidate will be highly proficient in Python, skilled in data visualization tools, and experienced in solving complex problems to drive measurable business outcomes such as revenue growth or cost reduction. K…",2025-01-01T11:53:10Z,Data Analyst,"python, data visualization","400,000 - 1,000,000",2,True
Data Analyst,Indium Software,India,250000,800000,"The Data Analyst in the CoE will provide end to end solution development, working in conjunction with the Domain Leads and Technology Partners. He is responsible for the delivery of solutions and solution changes which are driven by the business requirements as well as providing technical and development capabilities. Knowledge Skills:- Apache Synapse, SQL, SAP MDG ( Master Data Governance), Python and Data Analytics",2021-06-12T12:42:07Z,Data Analyst,"python, sql","250,000 - 800,000",2,True
